,author,comment,line,true
2285,Muhamad Reza Aditya,Tonjokkannya mantep kalii hahah,Muhamad Reza Aditya: Tonjokkannya mantep kalii hahah,1
2286,Alfin Adam,Actingnya kurang yg jadi inem,Alfin Adam: Actingnya kurang yg jadi inem,0
2287,Ufhix,Yaelah Mr. P juga mau ikut senam,Ufhix: Yaelah Mr. P juga mau ikut senam,0
2288,Anaya Nafarani,"Lagaknya tengil, ntar kalo dah tua dan punya anak baru nyesel deh seumur umur, Ineke aja tobat","Anaya Nafarani: Lagaknya tengil, ntar kalo dah tua dan punya anak baru nyesel deh seumur umur, Ineke aja tobat",1
2289,Frendy BLUK,Apakah harus jadi pertamax,Frendy BLUK: Apakah harus jadi pertamax,1
2290,novita radhitya,kalau gini sexy dan lucu aku jadi mau,novita radhitya: kalau gini sexy dan lucu aku jadi mau,0
2291,Aditya Yudha,pas miss popular kurang sexy payudaranya kbiar greget,Aditya Yudha: pas miss popular kurang sexy payudaranya kbiar greget,0
2292,Telpon Genggam,INEM MEMANG CANTIK MEMANG SEXY ASIKKK,Telpon Genggam: INEM MEMANG CANTIK MEMANG SEXY ASIKKK,1
2293,youtube explorer,tutorial pake vikini dong,youtube explorer: tutorial pake vikini dong,0
2294,Fathurrahman February,18021 mimpi2 yg orang gak banyak wajib ,Fathurrahman February: 18021 mimpi2 yg orang gak banyak wajib ,0
2295,Zaiful Arifin,Ass.dari permitaan pengemar tv chnel ambahka dewasa jadi tv Chanel desa supaya anak bawah umur ngk nonton permintaan dari penggemar terimakSih,Zaiful Arifin: Ass.dari permitaan pengemar tv chnel ambahka dewasa jadi tv Chanel desa supaya anak bawah umur ngk nonton permintaan dari penggemar terimakSih,1
2296,Alan Ramadoni,Lebih seksi de sasa carisa gua makin ngak tahan mbAk,Alan Ramadoni: Lebih seksi de sasa carisa gua makin ngak tahan mbAk,0
2297,Last_ Gamer,Perrhhh geram bngat aku lhat..,Last_ Gamer: Perrhhh geram bngat aku lhat..,1
2298,erik pangestu,Malu bra nya pemain bokep ..,erik pangestu: Malu bra nya pemain bokep ..,0
2299,aan fadilah,"good job min, ada ide baru disetiap episode. terima kasih. untuk videonya. Hehehe ","aan fadilah: good job min, ada ide baru disetiap episode. terima kasih. untuk videonya. Hehehe ",0
2300,Hend Puji,Gambarannya seharusnya diliatin,Hend Puji: Gambarannya seharusnya diliatin,0
2301,edy prakoso,Kapan nih....leabong bersma bidadari....hehee,edy prakoso: Kapan nih....leabong bersma bidadari....hehee,1
2302,arti nama,Penyebab utama sabun cepat habis sebelum waktunya,arti nama: Penyebab utama sabun cepat habis sebelum waktunya,1
2303,Sorek Satu,Wanita ....macam itu mbiasanya....enak dipandang......ketika dibukak....udah kaya tungku perbulan..,Sorek Satu: Wanita ....macam itu mbiasanya....enak dipandang......ketika dibukak....udah kaya tungku perbulan..,0
2304,Danang Sari,Gak ada intinya...cm narsis ...fuck...,Danang Sari: Gak ada intinya...cm narsis ...fuck...,1
2305,Alby Anak Kosan Tembalang,Itu pipinya bengkak ya?,Alby Anak Kosan Tembalang: Itu pipinya bengkak ya?,0
2306,chipta adhistya,kami suka cila berturbo,chipta adhistya: kami suka cila berturbo,0
2307,trending topic,Sumpah tokek nya terindah di indonesia,trending topic: Sumpah tokek nya terindah di indonesia,1
2308,Adhitiyo Pudiantoro,Makin sesi an sekian punya gua,Adhitiyo Pudiantoro: Makin sesi an sekian punya gua,0
2309,Wahyu Rialdo,maaf sebelumnya dapat referensi dari model giias ,Wahyu Rialdo: maaf sebelumnya dapat referensi dari model giias ,0
2310,odoyy 17,aduh nem aus nem nem..,odoyy 17: aduh nem aus nem nem..,1
2311,Suhendra Hendra,oghhh sweatif bs kalo gini,Suhendra Hendra: oghhh sweatif bs kalo gini,0
2312,imade bagas,Saya tidak tau apa yg mereka bicarakan tentang tubuhmu..,imade bagas: Saya tidak tau apa yg mereka bicarakan tentang tubuhmu..,0
2313,Isti Qomah,asli ada yg males karoten hahaha sama gege kok ndeso timur Hmm... i love you shassa carissa.,Isti Qomah: asli ada yg males karoten hahaha sama gege kok ndeso timur Hmm... i love you shassa carissa.,0
2314,Ahmad Harish,Btw backsound judulnya apa ya?,Ahmad Harish: Btw backsound judulnya apa ya?,0
2315,Eny Chan,Baru tau ada condom merek vivo itu vivo v berapa ya,Eny Chan: Baru tau ada condom merek vivo itu vivo v berapa ya,0
2316,akun model Porno,ayo mr pengen liat di laptop mantan anggora  ,akun model Porno: ayo mr pengen liat di laptop mantan anggora  ,0
2317,Fary Maliombo,Kami suka salah fokus :v,Fary Maliombo: Kami suka salah fokus :v,1
2318,Ningsi Noho,Gua nggak Suka video lo jorokkk nggak mendidik bangat,Ningsi Noho: Gua nggak Suka video lo jorokkk nggak mendidik bangat,0
2319,Ari Yuda,"Pasti nya itu loh seksi Indonesia memberikan sex education dan seksologi. Itu beda dengan porno. Tp penampilannya hot. Bikin yg nonton jd pada berzina mata. Dosa. Haram. Mungkin didengerin aja y, gak usah dilihat.","Ari Yuda: Pasti nya itu loh seksi Indonesia memberikan sex education dan seksologi. Itu beda dengan porno. Tp penampilannya hot. Bikin yg nonton jd pada berzina mata. Dosa. Haram. Mungkin didengerin aja y, gak usah dilihat.",0
2320,Billy ebe,sassha nggak seru sekalian sekali ah,Billy ebe: sassha nggak seru sekalian sekali ah,0
2321,Gede Golden,Yang dihisap tidak ada,Gede Golden: Yang dihisap tidak ada,1
2322,Iyus Senjaya,annisa .. emang apa yang hidup ??,Iyus Senjaya: annisa .. emang apa yang hidup ??,1
2323,BOY V24 JUNFARE NAVRAT,"ADEM BENER MIN LIAT MONTIR CANTIK YG SATU INI,,, NEXT VIDEO,,, I'M BAD BOY","BOY V24 JUNFARE NAVRAT: ADEM BENER MIN LIAT MONTIR CANTIK YG SATU INI,,, NEXT VIDEO,,, I'M BAD BOY",1
2324,Adik Si ocong,habis di kocok terus pada tidur,Adik Si ocong: habis di kocok terus pada tidur,0
2325,Izzan Khamdani,Saya 19 th. Ini konten 21+? Bodoamat. Wkwk.,Izzan Khamdani: Saya 19 th. Ini konten 21+? Bodoamat. Wkwk.,1
2326,Rama Dhani,Komennya pd sange njiiirr wkwk .. ,Rama Dhani: Komennya pd sange njiiirr wkwk .. ,1
2327,Dki Channel Production,Anjirrr bikin sangek ni model video nya... kacau dah... nyesel gue udah nonton,Dki Channel Production: Anjirrr bikin sangek ni model video nya... kacau dah... nyesel gue udah nonton,1
2328,dhik thea,sayang kurang seksi harusnya pake pakaian sex? Murahan semakin di pakat kegen inem...,dhik thea: sayang kurang seksi harusnya pake pakaian sex? Murahan semakin di pakat kegen inem...,0
2329,FILM MAKER,Tolong beri saya judul lagu di no 4,FILM MAKER: Tolong beri saya judul lagu di no 4,1
2330,H A K A I S H I N,percuma cantik kalo sudah ditiduri hahah,H A K A I S H I N: percuma cantik kalo sudah ditiduri hahah,0
2331,Rizky Assagaf,Sumpah gagal pokus hehehe,Rizky Assagaf: Sumpah gagal pokus hehehe,1
2332,Sofyan Agung,We gak sexy popular selamaku ??,Sofyan Agung: We gak sexy popular selamaku ??,0
2333,firdaus putra,Please Fuck me girl...,firdaus putra: Please Fuck me girl...,0
2334,irza zen,FOST BRO - Maendra Ulaim Motomobi Hehehe ,irza zen: FOST BRO - Maendra Ulaim Motomobi Hehehe ,0
2335,Zulvie 47,Saling subscribe nanti sya sub back,Zulvie 47: Saling subscribe nanti sya sub back,0
2336,Gaga hokki,Heheheeee lumayan kurang hot,Gaga hokki: Heheheeee lumayan kurang hot,1
2337,Ayu Widiyastuti,mirip kyk sibad hostnya,Ayu Widiyastuti: mirip kyk sibad hostnya,1
2338,Dedi Chandra,klu gd yakku..............wkwk,Dedi Chandra: klu gd yakku..............wkwk,0
2339,this Mr.Greatskiller,goblok asu ga bermanfaat,this Mr.Greatskiller: goblok asu ga bermanfaat,1
2340,Kasiful Hikam,Pelerrrr muke kecrotan,Kasiful Hikam: Pelerrrr muke kecrotan,1
2341,amar putra,"walaupun milih jari manusiawi bos, gimna lagi? ","amar putra: walaupun milih jari manusiawi bos, gimna lagi? ",0
2342,Angelina zhang,Wow..like you body..nice,Angelina zhang: Wow..like you body..nice,1
2343,andhika chiko,dan.... zzz zzz zzz getar ya ko jibs,andhika chiko: dan.... zzz zzz zzz getar ya ko jibs,1
2344,Dheo Rozi,Push up bra jd bkin inem mentul mentul,Dheo Rozi: Push up bra jd bkin inem mentul mentul,1
2345,balle bambu,"ketemu aeng di NERAKA ya nona nona,yang pasti rantau an jauh dari orang tua!!!ibu kalian mati bediri woyyyyyyy","balle bambu: ketemu aeng di NERAKA ya nona nona,yang pasti rantau an jauh dari orang tua!!!ibu kalian mati bediri woyyyyyyy",1
2346,Randi Mckenzie,Telanjang dong sayang ,Randi Mckenzie: Telanjang dong sayang ,0
2347,agustino kornelius,Kenyang ngeliatinnya bang,agustino kornelius: Kenyang ngeliatinnya bang,0
2348,Johny Wayan,Ckckck.. lo gue punya ni inem.. psti jdi rebutan tmen2 gue.. hahaha crooot ahh,Johny Wayan: Ckckck.. lo gue punya ni inem.. psti jdi rebutan tmen2 gue.. hahaha crooot ahh,1
2349,Gaming _Kocak,Jangan diet udah montok kayak gini ngapain diet kk sassha,Gaming _Kocak: Jangan diet udah montok kayak gini ngapain diet kk sassha,0
2350,Samsung Galaxy,makmak ooi to is the video ,Samsung Galaxy: makmak ooi to is the video ,0
2351,fredi gunawan,Cara join gold member atau premium nya bagaimana?,fredi gunawan: Cara join gold member atau premium nya bagaimana?,0
2352,ryan hafiz,udah sering y mbak..pngalaman bnget,ryan hafiz: udah sering y mbak..pngalaman bnget,0
2353,Nur Ahmad,"yo ngene iki seng entek"" i gogolan","Nur Ahmad: yo ngene iki seng entek"" i gogolan",1
2354,miampen ronce,"kl aku sering mau berhubungan , udah gak ada yg lebih lamaan min","miampen ronce: kl aku sering mau berhubungan , udah gak ada yg lebih lamaan min",0
2355,Eny Chan,Dia ga suka pake condom,Eny Chan: Dia ga suka pake condom,0
2356,J. Arethusa Kowalsky S.,Wah om mobi wahahahaha,J. Arethusa Kowalsky S.: Wah om mobi wahahahaha,0
2357,Riyan acil,"Seksi, Kya gadis lgi.","Riyan acil: Seksi, Kya gadis lgi.",1
2358,I Gede Tin Purnawa,"Gawattttt bikin konak aja ,,,,","I Gede Tin Purnawa: Gawattttt bikin konak aja ,,,,",1
2359,Zack Cloud,Sasha ganti aja si putih g string... belahanya dari belakang..,Zack Cloud: Sasha ganti aja si putih g string... belahanya dari belakang..,0
2360,BOY V24 JUNFARE NAVRAT,"salah satu angels favorit saya ini min,,,","BOY V24 JUNFARE NAVRAT: salah satu angels favorit saya ini min,,,",0
2361,Anwar Khan,kami suka double airbag..,Anwar Khan: kami suka double airbag..,1
2362,Andika Lentera,Tania ayu perfect beauty.....,Andika Lentera: Tania ayu perfect beauty.....,1
2363,Apil,perempuan 3 jurus lah kok 1. ,Apil: perempuan 3 jurus lah kok 1. ,0
2364,Ahsanul Musyafa,"mungkin INEM cita""nya ingin jadi bintang porno.","Ahsanul Musyafa: mungkin INEM cita""nya ingin jadi bintang porno.",1
2365,Qee Lanna,Persetan sama masakannya!,Qee Lanna: Persetan sama masakannya!,1
2366,Ardhi Ardhi,Jagan salahin para lelaki kalo nanti ke perkosa,Ardhi Ardhi: Jagan salahin para lelaki kalo nanti ke perkosa,1
2367,Kontoru- Sama,mayoritas yang buka bukan 21++,Kontoru- Sama: mayoritas yang buka bukan 21++,1
2368,Bang Igo,"Ora usah nginem wes mbak,tak dadekno bojoku wae yooo..","Bang Igo: Ora usah nginem wes mbak,tak dadekno bojoku wae yooo..",1
2369,Rudy Bints,Lebih hot lg donk min....!!,Rudy Bints: Lebih hot lg donk min....!!,0
2370,princeibnukbr,memabukkan kyk km puput,princeibnukbr: memabukkan kyk km puput,1
2371,dhik thea,sayang suara nya ga jelas mik nya kejauhan,dhik thea: sayang suara nya ga jelas mik nya kejauhan,1
2372,an droid,Pascol mn suaranya wkekeke. Tp tocil ni GA seru,an droid: Pascol mn suaranya wkekeke. Tp tocil ni GA seru,0
2373,Agus Suhardiman,"toket ngambil suruh tanggung masih banyak mini, ada yg lemes liat sassha trus @popular","Agus Suhardiman: toket ngambil suruh tanggung masih banyak mini, ada yg lemes liat sassha trus @popular",0
2374,Febry Angga,kak susunya buka dong kak,Febry Angga: kak susunya buka dong kak,1
2375,Erlangga Chester,"Pernah denger lagu latarnya di film Kill Bill, judulnya apa?","Erlangga Chester: Pernah denger lagu latarnya di film Kill Bill, judulnya apa?",1
2376,Danar Mahendra,"ngebayangin, kalau memang beneran ada, PRT yang keluar rumah dengan kostum / penampilan begitu..","Danar Mahendra: ngebayangin, kalau memang beneran ada, PRT yang keluar rumah dengan kostum / penampilan begitu..",1
2377,Anto Rizky,Toket nye kecil mukanye juga biasa aja.,Anto Rizky: Toket nye kecil mukanye juga biasa aja.,0
2378,dr Apry,"nglawaaan ini agak y,,,","dr Apry: nglawaaan ini agak y,,,",1
2379,vira salsa,nikah dong kalo pengen kaya gituh,vira salsa: nikah dong kalo pengen kaya gituh,0
2380,Imum Imam,Bukn islamm... Jngn di tiruuuuu kawann,Imum Imam: Bukn islamm... Jngn di tiruuuuu kawann,0
2381, t ,Kameramen nya amatirr, t : Kameramen nya amatirr,1
2382,Yohanai Mahendra,Pasukan sabun mana suaranya....!!!!!!!,Yohanai Mahendra: Pasukan sabun mana suaranya....!!!!!!!,0
2383,MFR HA,Ada tds fokus ke gerakan nya makin gak pake kondom ,MFR HA: Ada tds fokus ke gerakan nya makin gak pake kondom ,0
2384,Rifky Codot,"grace perfect, grace iskandar jomblo gak min?","Rifky Codot: grace perfect, grace iskandar jomblo gak min?",1
2385,bambs vlog coy,Pasti toket udah pada melar di kenyotin ama juri,bambs vlog coy: Pasti toket udah pada melar di kenyotin ama juri,1
2386,Tutorial Channel 21,Mukanya sassa ud tambahbtua,Tutorial Channel 21: Mukanya sassa ud tambahbtua,0
2387,ARYA_ ARIFIN. blitar patria,Yg oke cuma puput pandai masak trs cantik banget.,ARYA_ ARIFIN. blitar patria: Yg oke cuma puput pandai masak trs cantik banget.,0
2388,BOY V24 JUNFARE NAVRAT,"Ini mah idamannya mimin,,, wkwkwkwkwkw,,,","BOY V24 JUNFARE NAVRAT: Ini mah idamannya mimin,,, wkwkwkwkwkw,,,",1
2389,Anggie Herman,Grace iskandar...back,Anggie Herman: Grace iskandar...back,1
2390,Berdi Albauitat,boleh loh request dong inem wkwk,Berdi Albauitat: boleh loh request dong inem wkwk,0
2391,meimei Noob,Klo di sewa si inem brpa duit min?,meimei Noob: Klo di sewa si inem brpa duit min?,1
2392,Dead Pool,tipsnya mantaap ni sassha..siip..he,Dead Pool: tipsnya mantaap ni sassha..siip..he,1
2393,Azmi Maruf,Aduh gatel ni aku sewa ya,Azmi Maruf: Aduh gatel ni aku sewa ya,1
2394,Husen Widiyanto,liatin puting susunya kamu dong biar laki2 makin bnyk yg liat channel ini,Husen Widiyanto: liatin puting susunya kamu dong biar laki2 makin bnyk yg liat channel ini,1
2395,Rezaldi Aziz,Otong gwe langsung tegak lihat punya inem tania ayu,Rezaldi Aziz: Otong gwe langsung tegak lihat punya inem tania ayu,1
2396,irawan syams,Inem yg beginian bareng loyo lah ,irawan syams: Inem yg beginian bareng loyo lah ,0
2397,Radja Anggi,Klo main ma km nggk perlu pake kondom,Radja Anggi: Klo main ma km nggk perlu pake kondom,1
2398,Max Flare,Shasa kebnyakan kawin.. Jdi tmbh gemuk ,Max Flare: Shasa kebnyakan kawin.. Jdi tmbh gemuk ,0
2399,Anjas G-VLog,yang nonntonnnya salah fokus mana ,Anjas G-VLog: yang nonntonnnya salah fokus mana ,1
2400,Dani Maulana,Love u Sassha... Telan sperma ku dong...,Dani Maulana: Love u Sassha... Telan sperma ku dong...,1
2401,Fadil Sastra,alat2 di pikiran nampak,Fadil Sastra: alat2 di pikiran nampak,0
2402,Muhammad Fadly,Yg kek gini ni yg buat aku betah di kamar.,Muhammad Fadly: Yg kek gini ni yg buat aku betah di kamar.,1
2403,D M,bayangkan itu semuanya adalah istri anda,D M: bayangkan itu semuanya adalah istri anda,1
2404,otomotif jadul,gw gk tau inem ngomong apa. gw fokus sama gunung kembar aja ,otomotif jadul: gw gk tau inem ngomong apa. gw fokus sama gunung kembar aja ,1
2405,Yana Mulyana,Kurang sexy lbh hot lgh,Yana Mulyana: Kurang sexy lbh hot lgh,0
2406,Galuh Wasesa,pingin hisap payadaramu..,Galuh Wasesa: pingin hisap payadaramu..,1
2407,fajar yudistira,lagunya apaan ya ? mohon info,fajar yudistira: lagunya apaan ya ? mohon info,1
2408,Anton Aja,"Ah teori doank, prakteknya donkk????","Anton Aja: Ah teori doank, prakteknya donkk????",0
2409,fardan sajalahhh,novia multitalent banget,fardan sajalahhh: novia multitalent banget,1
2410,Ipul Alam,Sugguh malu ortu lo jablay,Ipul Alam: Sugguh malu ortu lo jablay,1
2411,Risky Pahlevi,Sekalian aje gx pake baju goblok,Risky Pahlevi: Sekalian aje gx pake baju goblok,1
2412,Juni Angga,Susah jg untuk tidak di lihat ,Juni Angga: Susah jg untuk tidak di lihat ,1
2413,Bastian Nugraha,Pisang aku kok diemut...,Bastian Nugraha: Pisang aku kok diemut...,0
2414,R Satrio,Paling best lah ini.. just red bra,R Satrio: Paling best lah ini.. just red bra,1
2415,Yohanes Soeripto,"Mbah arep tako karo gendhok sing ayu dewe sak jagad., mbah iki lek ndelok arek wedhok ayu koyo gendhok SASSHA Carissa ko mesti kepingen....kawin maneh yo... ?? iku opo normal to ndok...??","Yohanes Soeripto: Mbah arep tako karo gendhok sing ayu dewe sak jagad., mbah iki lek ndelok arek wedhok ayu koyo gendhok SASSHA Carissa ko mesti kepingen....kawin maneh yo... ?? iku opo normal to ndok...??",1
2416,wayan dharmawan,"Kalo baby M,diduplikatin jd sexdoll mantap kali ya....pesen atu.xoxo","wayan dharmawan: Kalo baby M,diduplikatin jd sexdoll mantap kali ya....pesen atu.xoxo",1
2417,7thfloor,Apa bedanya show disini sm show di alex*is,7thfloor: Apa bedanya show disini sm show di alex*is,0
2418,Romi 240897,kok gak di buka semua,Romi 240897: kok gak di buka semua,0
2419,niceman1950,Mantap min...banyakin ya jalan2 nya...sama kalau bisa sekalian bekal apa aj yg mau dibawa biar kita yg mau petualang jg sama siapin barangnya...fashion buat petualang...haha,niceman1950: Mantap min...banyakin ya jalan2 nya...sama kalau bisa sekalian bekal apa aj yg mau dibawa biar kita yg mau petualang jg sama siapin barangnya...fashion buat petualang...haha,1
2420,Ahmad Farid Faruh aq coba lihat 40t,hmad Farid Faruh aq coba lihat 40th,Ahmad Farid Faruh aq coba lihat 40th,0
2421,Dimas ajiputra,Alur cerita mah gak perlu jelas yang perlu itu toket gede kalo bisa kancing nya bukak satu lagi,Dimas ajiputra: Alur cerita mah gak perlu jelas yang perlu itu toket gede kalo bisa kancing nya bukak satu lagi,1
2422,Ahmad Kohar,coba bugil pasti mantep banget,Ahmad Kohar: coba bugil pasti mantep banget,0
2423,Herp Ganteng,Hahaha anjay  liat moba dulu ah,Herp Ganteng: Hahaha anjay  liat moba dulu ah,1
2424,Anas Sunflower,Eta susunya buka semua,Anas Sunflower: Eta susunya buka semua,1
2425,Danang Lukito,minta no wa tante sasha donk,Danang Lukito: minta no wa tante sasha donk,1
2426,Syaibatul Hamdi,Ini baru ada gregetnya jauh lebih besar daripada saat di ruang terbuka ? Kalau ente di situ dari penis dari mereka ada yang prrnah saya booking,Syaibatul Hamdi: Ini baru ada gregetnya jauh lebih besar daripada saat di ruang terbuka ? Kalau ente di situ dari penis dari mereka ada yang prrnah saya booking,0
2427,Aden Deni,"Semunx pmert tetek dn pepek gejotn bos""","Aden Deni: Semunx pmert tetek dn pepek gejotn bos""",0
2428,Diah Rahyu,kakinya dong di perhatikan mbak inem,Diah Rahyu: kakinya dong di perhatikan mbak inem,1
2429,array s,"Kaya nya bener isis itu udah pnya basis d Indo. Liat komen2 simpatisan nya disini. Munafik sekali sdh nonton & coli gratis tp menjudge org. mudah2n mereka cepat deklarasi perang lah k negara ini. Biar cepet ketauan muka2 nya, biar cepet ditumpas juga. Udah muak gw liat mereka nyusup d masyarakat. Biar Indo balik lg ke era 80's dan 90's, lebih bebas tnp ada perusuh dan teroris kya skrg.","array s: Kaya nya bener isis itu udah pnya basis d Indo. Liat komen2 simpatisan nya disini. Munafik sekali sdh nonton & coli gratis tp menjudge org. mudah2n mereka cepat deklarasi perang lah k negara ini. Biar cepet ketauan muka2 nya, biar cepet ditumpas juga. Udah muak gw liat mereka nyusup d masyarakat. Biar Indo balik lg ke era 80's dan 90's, lebih bebas tnp ada perusuh dan teroris kya skrg.",1
2430,Faiq Psiko,audionya qok kecil bgt,Faiq Psiko: audionya qok kecil bgt,1
2431,novian anggio,setelah melihat video ini gue mendadak pengin jd tukang service ac,novian anggio: setelah melihat video ini gue mendadak pengin jd tukang service ac,1
2432,Rillo Abdie,Kami suka TWIN TURBO!!!,Rillo Abdie: Kami suka TWIN TURBO!!!,0
2433,Kahiu Ps,Yang nonton sambil lihat coment ,Kahiu Ps: Yang nonton sambil lihat coment ,0
2434,Rizky Putra Adilana,"kalo bisa tiap review mobil, om mobi gandeng aja neng saaya siap meluk. ","Rizky Putra Adilana: kalo bisa tiap review mobil, om mobi gandeng aja neng saaya siap meluk. ",0
2435,Fandy Matara,Zaenal ini bagus kok diputer puter ya,Fandy Matara: Zaenal ini bagus kok diputer puter ya,0
2436,Adis Nugraga,nanggung mlu cuplikannya,Adis Nugraga: nanggung mlu cuplikannya,0
2437,Maniak Gamers,Mantap neh di jadiin tips mlm jumtan ma sissy anaknya nggak berada sex.,Maniak Gamers: Mantap neh di jadiin tips mlm jumtan ma sissy anaknya nggak berada sex.,0
2438,Raymond Pasaribu,99 persen pria jadi sagne,Raymond Pasaribu: 99 persen pria jadi sagne,1
2439,wawa darmawan,bahan coli di censor wkwkkw,wawa darmawan: bahan coli di censor wkwkkw,1
2440,Noname 8144,"timur kntl bukan barat, lanjutkan","Noname 8144: timur kntl bukan barat, lanjutkan",1
2441,hoiron hoiron,Edan tenan iki bocah dadane guuuadeee,hoiron hoiron: Edan tenan iki bocah dadane guuuadeee,1
2442,Abel Iz,Tingkat kekenyalan sempurna..,Abel Iz: Tingkat kekenyalan sempurna..,1
2443,ngakak 4g,Bikin video bokep dong,ngakak 4g: Bikin video bokep dong,0
2444,arie girls,bibirnya nih cewek aneh banget sih??kayak disuntik silikon.....,arie girls: bibirnya nih cewek aneh banget sih??kayak disuntik silikon.....,1
2445,Syamhudi Maulana,Ga usah di tayangin kalo di sensor mah....,Syamhudi Maulana: Ga usah di tayangin kalo di sensor mah....,1
2446,zeni mustofa,Kpan yaa aku bisa ktemu ama Cyla pengen Selfie bareng lho..,zeni mustofa: Kpan yaa aku bisa ktemu ama Cyla pengen Selfie bareng lho..,1
2447,farming comunity,puting nya kak Grace  pas lagi sensasi mulu.. hehehe,farming comunity: puting nya kak Grace  pas lagi sensasi mulu.. hehehe,0
2448,Emir Adenaury,Salah satu product placement/video brand terkeren. Good job popular.,Emir Adenaury: Salah satu product placement/video brand terkeren. Good job popular.,0
2449,Arpen Doni,buah dadany..aduuuuu...,Arpen Doni: buah dadany..aduuuuu...,0
2450,Hanya Doy,Ahhh sayang pakai nips cap jadi gak nyemplak. Nanggung amat,Hanya Doy: Ahhh sayang pakai nips cap jadi gak nyemplak. Nanggung amat,1
2451,antuk w3nanthp,Ga kram bukan km @sassha.....,antuk w3nanthp: Ga kram bukan km @sassha.....,0
2452,David Prawira,Beruntung jadi suaminya GEge 2 in one place,David Prawira: Beruntung jadi suaminya GEge 2 in one place,0
2453,Crystal Young,inem nda cocok jdi pembantu gw kaya gitu gw ew,Crystal Young: inem nda cocok jdi pembantu gw kaya gitu gw ew,0
2454,Crismon Fransisco,subscribe langsung keren kak,Crismon Fransisco: subscribe langsung keren kak,0
2455,Amin setiawan,Tumben tipsnya kok dikit hehehe,Amin setiawan: Tumben tipsnya kok dikit hehehe,1
2456,Sahabat Ossas The Gengs,Persiapan ngentot nih,Sahabat Ossas The Gengs: Persiapan ngentot nih,1
2457,TOK TIK,Nonton sambil ngocok !!,TOK TIK: Nonton sambil ngocok !!,1
2458,java island,Manteb ada den dimas... ,java island: Manteb ada den dimas... ,0
2459,ho o,dosa kak ganti parodi yg laen napa,ho o: dosa kak ganti parodi yg laen napa,1
2460,Alvaro Gavriel,Toket ny itu yg GK kuat,Alvaro Gavriel: Toket ny itu yg GK kuat,1
2461,bayu kristanto,Sekali-kali coba dimobil sat pol PP,bayu kristanto: Sekali-kali coba dimobil sat pol PP,1
2462,Resident Evil,Apa cuman Gw yg nonton sambil coli??!,Resident Evil: Apa cuman Gw yg nonton sambil coli??!,1
2463,brafas bz 1130,"Hancur sex,ingat disubah behan","brafas bz 1130: Hancur sex,ingat disubah behan",0
2464,rafandra rakha,Pengen liat jembut sassa carisa bisa g ?,rafandra rakha: Pengen liat jembut sassa carisa bisa g ?,1
2465,Ramadhan Sudjai,Kami suka tenaga TURBO buat yang beginian,Ramadhan Sudjai: Kami suka tenaga TURBO buat yang beginian,0
2466,Sheane Sullivan,SUSUNYA MW TERBAGUS JEME? Tempek beritahus Muhammad: jadi pengen dijepit sama kak gege,Sheane Sullivan: SUSUNYA MW TERBAGUS JEME? Tempek beritahus Muhammad: jadi pengen dijepit sama kak gege,0
2467,marianus Mulyanto,cantik banget ni cewe.,marianus Mulyanto: cantik banget ni cewe.,0
2468,Adi Putra,"ampun omm mobii, ingat anak istri wkwk","Adi Putra: ampun omm mobii, ingat anak istri wkwk",0
2469,anak soleh.,Pasukan sabun merapat,anak soleh.: Pasukan sabun merapat,0
2470,NR Official - Tutorial Android,ini cameramen dan editornya pasti lupa kedip . haha,NR Official - Tutorial Android: ini cameramen dan editornya pasti lupa kedip . haha,1
2471,ArthuR RivanA,Mbak sassha boobsnya merah merona yah? Jadi pngen nih,ArthuR RivanA: Mbak sassha boobsnya merah merona yah? Jadi pngen nih,1
2472,bayu ramadhan,fokus ma grace iskandar ,bayu ramadhan: fokus ma grace iskandar ,0
2473,Warkopers,Sassha Carissa Love You Sassha Carissa,Warkopers: Sassha Carissa Love You Sassha Carissa,0
2474,Bahyu Andrian,gue salah fokus sama belahan dadanya,Bahyu Andrian: gue salah fokus sama belahan dadanya,0
2475,ALIF RHAMDANI,"Ntah knp jdi berasa aneh lama lama sma chnl ni, knp gk upload aja full versinya di yutub, toh lebih mudah diliat sma yg lain nya juga, walaupun di apk yg full berbayar gk mahal mahal amat, tpi knp gtuloh gk di yt aja","ALIF RHAMDANI: Ntah knp jdi berasa aneh lama lama sma chnl ni, knp gk upload aja full versinya di yutub, toh lebih mudah diliat sma yg lain nya juga, walaupun di apk yg full berbayar gk mahal mahal amat, tpi knp gtuloh gk di yt aja",1
2476,Fauzan Mutakin,Mbak mau gak ewean sama aku,Fauzan Mutakin: Mbak mau gak ewean sama aku,1
2477,Moldy Yadi,kurang gede.. vebby amora/tania ayu siregar,Moldy Yadi: kurang gede.. vebby amora/tania ayu siregar,1
2478,inspektor gaban,"Patutlaaa Rasullallah cakap golongan wjwk kyk mu nem... harum tubuh mu beserta keringan di dadamu,menambah gaidal enak dehh","inspektor gaban: Patutlaaa Rasullallah cakap golongan wjwk kyk mu nem... harum tubuh mu beserta keringan di dadamu,menambah gaidal enak dehh",0
2479,Sigit Mrc,Dua bizz buat nambah dosa nya ,Sigit Mrc: Dua bizz buat nambah dosa nya ,0
2480,Rinaldy Hutaksaya,kan om mobi kaya kok takut miskin wjwkwkwkwkw,Rinaldy Hutaksaya: kan om mobi kaya kok takut miskin wjwkwkwkwkw,0
2481,ikram rizaldi,"videonya ga jelas, ngegantung banget, kurang lengkap pembahasannya.","ikram rizaldi: videonya ga jelas, ngegantung banget, kurang lengkap pembahasannya.",1
2482,basabasi loe,Video klip apaan ini? Kok isinya membuat saya sudah ada yang banget dibanding yg lain..wkwkwk gemes liat nya ,basabasi loe: Video klip apaan ini? Kok isinya membuat saya sudah ada yang banget dibanding yg lain..wkwkwk gemes liat nya ,0
