,author,comment,line,true
3235,Anditian Pranata,saya pengalaman kayak gini gak boros baterai kalau goblog ama bungkus ngaceng itu baru gawat ,Anditian Pranata: saya pengalaman kayak gini gak boros baterai kalau goblog ama bungkus ngaceng itu baru gawat ,0
3236,masmuklisturi,"Yang mancing2 sp, sdh klo Jual CD di pajang, skrg giliran pakai juga msh di panjang sama isi y ... Jk terjadi ... Blg y diperkosa","masmuklisturi: Yang mancing2 sp, sdh klo Jual CD di pajang, skrg giliran pakai juga msh di panjang sama isi y ... Jk terjadi ... Blg y diperkosa",1
3237,agustya andika,"Biasa aja ,, kok modelnya kyk emak2","agustya andika: Biasa aja ,, kok modelnya kyk emak2",0
3238,Lavender,"warnanya kok butek banget ya, wkwk, editornya asal asalan","Lavender: warnanya kok butek banget ya, wkwk, editornya asal asalan",0
3239,Gilang Lawliet,Gue baru tau ternyata sperma mngandung Kalsium yah,Gilang Lawliet: Gue baru tau ternyata sperma mngandung Kalsium yah,1
3240,Muhammad iqbal A Sidik,Kalau tips bercinta seperti sayur murah seribu 1,Muhammad iqbal A Sidik: Kalau tips bercinta seperti sayur murah seribu 1,0
3241,brennan jarvis,crystal you're af karna cewek  ,brennan jarvis: crystal you're af karna cewek  ,0
3242,Dark Afkar,Sasha coba ehh tips dari aku mah ini tips ya 5 cara untuk merayu wanita biar bisa sex? Plz,Dark Afkar: Sasha coba ehh tips dari aku mah ini tips ya 5 cara untuk merayu wanita biar bisa sex? Plz,1
3243,Igni Ariyanto,lumayan deket dari jakarta ya :v,Igni Ariyanto: lumayan deket dari jakarta ya :v,0
3244,Cahyo Kutupa,mbak mintak sangu doonnngg buat beli dogfood,Cahyo Kutupa: mbak mintak sangu doonnngg buat beli dogfood,0
3245,KMI REPUBLIC, inem yg berani taruhan itu ayam masih mentah kalo di makan sebab yg warna coklat itu hehehe @popularmagazine,KMI REPUBLIC:  inem yg berani taruhan itu ayam masih mentah kalo di makan sebab yg warna coklat itu hehehe @popularmagazine,0
3246,arie pratomo,rya alvent sama mbak ,arie pratomo: rya alvent sama mbak ,0
3247,Ekha Soraya,aku butuh pembantu rumah tangga... ini pin ku DDE73418,Ekha Soraya: aku butuh pembantu rumah tangga... ini pin ku DDE73418,1
3248,koka reyan,langsung praktekin aja klo berani wkwkw,koka reyan: langsung praktekin aja klo berani wkwkw,1
3249,Putra Putri,klo gak ada surga nya ? mau apa ! ,Putra Putri: klo gak ada surga nya ? mau apa ! ,0
3250,Agnia Nazma,apa manpaat senam malam,Agnia Nazma: apa manpaat senam malam,1
3251,EDY SUTIKNO,Masakan dari mana non..!!!,EDY SUTIKNO: Masakan dari mana non..!!!,1
3252,sumber terus,PUTRI Zairah: aku rela kamu apain aja,sumber terus: PUTRI Zairah: aku rela kamu apain aja,1
3253,shahira yulista,"Coba kalau di buka semua,yg like pasti berjuta","shahira yulista: Coba kalau di buka semua,yg like pasti berjuta",0
3254,dedyrockman11,bajunya ga ada sexy2 nya,dedyrockman11: bajunya ga ada sexy2 nya,0
3255,vanitas,Love your tattoo babe.,vanitas: Love your tattoo babe.,1
3256,Mr Wacoy,"Inem waktu kecil makan apa sih, pertumbuhanya gede..","Mr Wacoy: Inem waktu kecil makan apa sih, pertumbuhanya gede..",1
3257,Edi Suharto, ku mo jg donk kalo ma sassha gmn mo.... mantaabbb,Edi Suharto:  ku mo jg donk kalo ma sassha gmn mo.... mantaabbb,0
3258,Rachman Soeroso,Saya juga dekut cuma 1 yg dikasih tau.. gw terlalu vulgar..saya tidak suka vulgar..saya suka turbo..,Rachman Soeroso: Saya juga dekut cuma 1 yg dikasih tau.. gw terlalu vulgar..saya tidak suka vulgar..saya suka turbo..,0
3259,Kadal Wow,anjay inem.e jan uuuh,Kadal Wow: anjay inem.e jan uuuh,1
3260,Juliyanto,cople ajh cantik hitam,Juliyanto: cople ajh cantik hitam,0
3261,ari auto tante mobi marah nant,ri auto tante mobi marah nanti,ari auto tante mobi marah nanti,0
3262,Christopher Rezha,Modelnya siapa min cantik deh hahahah fokus ke senyumannya,Christopher Rezha: Modelnya siapa min cantik deh hahahah fokus ke senyumannya,1
3263,Budi Utama,Ga kebayang rasa nya si otong di jepit nenen nya,Budi Utama: Ga kebayang rasa nya si otong di jepit nenen nya,1
3264,Nh Storee,itu cuma 2alasan bukan 5 alasan,Nh Storee: itu cuma 2alasan bukan 5 alasan,1
3265,Sahirin Sahirin,Enak gk pake kondom mba lebih greget,Sahirin Sahirin: Enak gk pake kondom mba lebih greget,0
3266,Ray z96,baru za pertama nnton dah bikin baper.. huuh,Ray z96: baru za pertama nnton dah bikin baper.. huuh,1
3267,Mochsyaiful Ms,"Hebat 2, sexsi dan cuantikx luarr biasa ,bagi dong aku juga mau ., kalau kayak gini !!!.... Hhhmm","Mochsyaiful Ms: Hebat 2, sexsi dan cuantikx luarr biasa ,bagi dong aku juga mau ., kalau kayak gini !!!.... Hhhmm",1
3268,randy juliansyah,"the trailer's already told us the whole stories, i'm not interested anymore","randy juliansyah: the trailer's already told us the whole stories, i'm not interested anymore",1
3269,heri yadi,fak anjer..  vidio ga mendidik...  tapi ane suka.,heri yadi: fak anjer..  vidio ga mendidik...  tapi ane suka.,1
3270,Satong Setiawan,Tambah umur tambah tuA wajahx kok  kayak waria yaaa,Satong Setiawan: Tambah umur tambah tuA wajahx kok  kayak waria yaaa,0
3271,Zakia Hasan Assegaf,pengabdi dajjal siluman laut,Zakia Hasan Assegaf: pengabdi dajjal siluman laut,0
3272,Deden Julian,Cuma saran.. editan nya biasa aja gausah ada emot gitu.. sukses terus buat inem nya.. ,Deden Julian: Cuma saran.. editan nya biasa aja gausah ada emot gitu.. sukses terus buat inem nya.. ,1
3273,Shodikin,Perusak generasi bangsa,Shodikin: Perusak generasi bangsa,0
3274,RAHMAT CHANNEL,Jual tubuh untuk cari uang..,RAHMAT CHANNEL: Jual tubuh untuk cari uang..,1
3275,key mi,I have A big Boob..u want Pm,key mi: I have A big Boob..u want Pm,1
3276,Anonymous GAMING,astafirullahalazim bertaubat sebelum kiamat.allah akan memberi hukuman di akhirat,Anonymous GAMING: astafirullahalazim bertaubat sebelum kiamat.allah akan memberi hukuman di akhirat,1
3277,viken kavanial,Yang jadi inem tania ayu aja,viken kavanial: Yang jadi inem tania ayu aja,0
3278,Alim Andrifky,EFEKTIS!! Lontents ga pake  Bra nya,Alim Andrifky: EFEKTIS!! Lontents ga pake  Bra nya,0
3279,Shadow Ajin Boby Bella,Yang mau nampung inem ayo merapat... INEMnya cuman punya Nyonya ajah coba yang punya Pak BoSS... habis lu nem ke gitu!!,Shadow Ajin Boby Bella: Yang mau nampung inem ayo merapat... INEMnya cuman punya Nyonya ajah coba yang punya Pak BoSS... habis lu nem ke gitu!!,1
3280,adont ghifary,badanya kecil tp susunya gede,adont ghifary: badanya kecil tp susunya gede,0
3281,Sewa Sanjaya,"gw norak, layarnya bisa diputer puter ya ","Sewa Sanjaya: gw norak, layarnya bisa diputer puter ya ",0
3282,Ibnu Mundzir,"coba yg berunsur mah yg bagus, berarti gakang montok dan berkali-kali ;-) ","Ibnu Mundzir: coba yg berunsur mah yg bagus, berarti gakang montok dan berkali-kali ;-) ",0
3283,M. Jugill,ini alem um at ange anget.......ngoserrrr,M. Jugill: ini alem um at ange anget.......ngoserrrr,1
3284,Patana Satya,arjun juna merah merona,Patana Satya: arjun juna merah merona,0
3285,Upik laela hanun,I like' itu so uenak tnan lagi lgi,Upik laela hanun: I like' itu so uenak tnan lagi lgi,1
3286,Febri Marlis,Ga enak pake kondom..,Febri Marlis: Ga enak pake kondom..,1
3287,don roberto,Popular masuk kategori majalah prostitusi,don roberto: Popular masuk kategori majalah prostitusi,1
3288,Tiko Prastyo,"theme song nya ditulis juga dong sob, trims","Tiko Prastyo: theme song nya ditulis juga dong sob, trims",1
3289,BoyYunas 91,seruuu ni. jd pengen coba,BoyYunas 91: seruuu ni. jd pengen coba,1
3290,Theo Yanto,loh pengen gue pegang si mbak uuuus  si sassha carisa,Theo Yanto: loh pengen gue pegang si mbak uuuus  si sassha carisa,0
3291,gandi alex,Gregettt sampe tumpe wkwkwk banjir donk,gandi alex: Gregettt sampe tumpe wkwkwk banjir donk,0
3292,maz lumad,Enak bersetubuh (balik wkwkwkwk,maz lumad: Enak bersetubuh (balik wkwkwkwk,0
3293,Joni Bravo,"0:59 nice moment : when ur wife think ur ""REALLY JUST"" Playing GOLF","Joni Bravo: 0:59 nice moment : when ur wife think ur ""REALLY JUST"" Playing GOLF",1
3294,Vaynder Ley,Apa tidaknya 7.9M views kalo thumbnail itu maciam,Vaynder Ley: Apa tidaknya 7.9M views kalo thumbnail itu maciam,0
3295,mentari senja,durasinya yg panjang mbak,mentari senja: durasinya yg panjang mbak,1
3296,Rasio oleh Arif,tips dinner IG & H @ Hius ,Rasio oleh Arif: tips dinner IG & H @ Hius ,0
3297,Sergio Moreno,Boleh juara cantik tapi kurang sexy kalau gak pake bikini,Sergio Moreno: Boleh juara cantik tapi kurang sexy kalau gak pake bikini,0
3298,Hendi Donquixote,ampe crooottt nontonnya,Hendi Donquixote: ampe crooottt nontonnya,1
3299,gunawan iwan,pagi-pagi udh bikin bangun kemanakan saya.,gunawan iwan: pagi-pagi udh bikin bangun kemanakan saya.,1
3300,Frendy BLUK,Apakah hendry Bd Sofiyanto: kak grace tmbk seksi aja,Frendy BLUK: Apakah hendry Bd Sofiyanto: kak grace tmbk seksi aja,0
3301,EFAN UCIHA,q juga mau kalo sama sasha.  tuh teteknx kenceng hehehe,EFAN UCIHA: q juga mau kalo sama sasha.  tuh teteknx kenceng hehehe,1
3302,Ipung Retroville,mana prakteknya kalo cuma ngomong gini doang mah kuno,Ipung Retroville: mana prakteknya kalo cuma ngomong gini doang mah kuno,1
3303,DMC Remix,Gimana ya caranya supaya bisa gede & tebel,DMC Remix: Gimana ya caranya supaya bisa gede & tebel,1
3304,pasopati Solo,sayang kecantikan mu begitu murah .,pasopati Solo: sayang kecantikan mu begitu murah .,1
3305,AVIAT RAMADHANA EMERGENCY AZHAN KONSTRUKSI,Yang tatoan baju ungu bener2 menggairahkan,AVIAT RAMADHANA EMERGENCY AZHAN KONSTRUKSI: Yang tatoan baju ungu bener2 menggairahkan,0
3306,ferian pradita,pake kondom g enak kali,ferian pradita: pake kondom g enak kali,1
3307,dangdut tv kabel,chanel ku juga hoooooooot lho,dangdut tv kabel: chanel ku juga hoooooooot lho,0
3308,Sung Sam,kurang keejaan y mandi kaya gitu anak kecil y bisa,Sung Sam: kurang keejaan y mandi kaya gitu anak kecil y bisa,1
3309,Alan Ramadoni,Mau sendiri atau berdua kalo pakaiannya tertutup sama bosan tapi kalo pakai bra aja dan CD psti seruuuuu,Alan Ramadoni: Mau sendiri atau berdua kalo pakaiannya tertutup sama bosan tapi kalo pakai bra aja dan CD psti seruuuuu,1
3310,eboy boy,dr td main gmn mau croottin? ,eboy boy: dr td main gmn mau croottin? ,0
3311,Ilham Maula,Hayo prakteknya g pke kondom langsung praktek tuh sama aku ,Ilham Maula: Hayo prakteknya g pke kondom langsung praktek tuh sama aku ,0
3312,Deny Ari,cantikan Sasha yg dulu..,Deny Ari: cantikan Sasha yg dulu..,0
3313,Zalle88 88,Ini baru cocok pengganti Inem... Mending tambah tangga Hehehe. ,Zalle88 88: Ini baru cocok pengganti Inem... Mending tambah tangga Hehehe. ,0
3314,anton leo,"Dri pda cri majikan baru,gmna klian pnya pmbntu kyk inemm,, mau d apain","anton leo: Dri pda cri majikan baru,gmna klian pnya pmbntu kyk inemm,, mau d apain",0
3315,gaming jelek,Wah gede amat susunya mantap,gaming jelek: Wah gede amat susunya mantap,0
3316,As'ad Wae,Punya sassha lebih gedee,As'ad Wae: Punya sassha lebih gedee,1
3317,ciko peng,"jangan pake pelumas dari oli mesin, minyak rem, dsb hehehe..","ciko peng: jangan pake pelumas dari oli mesin, minyak rem, dsb hehehe..",1
3318,Aguz Rahayu,Anjirrr otngku berontak kamu ,Aguz Rahayu: Anjirrr otngku berontak kamu ,0
3319,ardiansyah ansyah,gk make bh mantep jiwa,ardiansyah ansyah: gk make bh mantep jiwa,1
3320,Klin Din,marni dong di rumah coba,Klin Din: marni dong di rumah coba,0
3321,Dark Afkar,Thanks tips apaan ini,Dark Afkar: Thanks tips apaan ini,0
3322,gunawan wiji saputra,"Padahal toketnya anyeb alias hambargua salfok sama tuh paha coba aja rok.nya diangkat lagi, pasti kelihatan tuh tempat nggesek kartu kredit... gesek keluar duit","gunawan wiji saputra: Padahal toketnya anyeb alias hambargua salfok sama tuh paha coba aja rok.nya diangkat lagi, pasti kelihatan tuh tempat nggesek kartu kredit... gesek keluar duit",1
3323,Setyo Adipiwulang,Mbak jangan banyak bicara sini main sama om,Setyo Adipiwulang: Mbak jangan banyak bicara sini main sama om,1
3324,Rex Dinsim,Inem gue punya pembantu ky gtu,Rex Dinsim: Inem gue punya pembantu ky gtu,0
3325,Andi Adi,gk kuat amat sih inem,Andi Adi: gk kuat amat sih inem,0
3326,Alfons Santoso,"Tania, Anisa, Irene... cantik semua...","Alfons Santoso: Tania, Anisa, Irene... cantik semua...",1
3327,Queen Mania,Allah SWT tidak pernah menyembunyikan keindahan alam ciptaanNya.,Queen Mania: Allah SWT tidak pernah menyembunyikan keindahan alam ciptaanNya.,1
3328,IpaNx Yakuza,uhhh buat bahan coli enak broo,IpaNx Yakuza: uhhh buat bahan coli enak broo,1
3329,TC CHANEL,mantapp.....  subscribe back bos.. ,TC CHANEL: mantapp.....  subscribe back bos.. ,0
3330,Ade Fajar,PUNYA BANYAK UANG PUNYA PANGKAT TINGGI KLO GAK PUNYA BIDADARI MANIS NIE PERCUMA ITU SEMUA,Ade Fajar: PUNYA BANYAK UANG PUNYA PANGKAT TINGGI KLO GAK PUNYA BIDADARI MANIS NIE PERCUMA ITU SEMUA,1
3331,Name Cannot Be Blank,sumpah..andrea cantik bgt yah disini ,Name Cannot Be Blank: sumpah..andrea cantik bgt yah disini ,1
3332,Muhammad Luthfi,Cantik seksi tp sayang di bagi2 :v,Muhammad Luthfi: Cantik seksi tp sayang di bagi2 :v,1
3333,OnComp Tea,"Mampir channel saya boss, siapa tau ketagihan. dijamin betah deh :xD","OnComp Tea: Mampir channel saya boss, siapa tau ketagihan. dijamin betah deh :xD",1
3334,eko H,mbak sasha bisa bikin shampo laris,eko H: mbak sasha bisa bikin shampo laris,1
3335,inonk69,Kalau puting km warna kalian apa nih? Kl bole nebak yg ijo coklat tua yg merah coklat terang,inonk69: Kalau puting km warna kalian apa nih? Kl bole nebak yg ijo coklat tua yg merah coklat terang,1
3336,Mohd Firdauz,gedik nak mampos.. sundalllll,Mohd Firdauz: gedik nak mampos.. sundalllll,1
3337,Erick Tulus,Puting ada yang berharga lebih banyak lagi,Erick Tulus: Puting ada yang berharga lebih banyak lagi,0
3338,SUXRABbyARKENUNG NANTI KESEUTUEE ZH,"I love The God TERBALU ALLAH Di Bayar Mahal Makasih HIHAMAN , lah ini lebih murah dari motor nmx ","SUXRABbyARKENUNG NANTI KESEUTUEE ZH: I love The God TERBALU ALLAH Di Bayar Mahal Makasih HIHAMAN , lah ini lebih murah dari motor nmx ",0
3339,MySeaJin,Kok ga sekalian diajarkan prakteknya toh mbak. Teori mulu ,MySeaJin: Kok ga sekalian diajarkan prakteknya toh mbak. Teori mulu ,1
3340,Dragon Ball,Kaya di dunia. Bisa gak? Hahah. Kocak deh kamu Kak. Oh ya jangan lupa ya nonton full versionnya di Popular Now https://www.Popular-World.com/Apps ,Dragon Ball: Kaya di dunia. Bisa gak? Hahah. Kocak deh kamu Kak. Oh ya jangan lupa ya nonton full versionnya di Popular Now https://www.Popular-World.com/Apps ,0
3341,Rere Romanisti,Bahagianya hidup didunia.. Nikmati trus .. sebelum kematian.. :) kehidupan duniawi .. truss.. dan truss.. ayo nikmati.. lupakan kewajiban kpd Tuhan.. ayo.. nikmati trus selagi ada waktu.. :) salam dari langit.. ,Rere Romanisti: Bahagianya hidup didunia.. Nikmati trus .. sebelum kematian.. :) kehidupan duniawi .. truss.. dan truss.. ayo nikmati.. lupakan kewajiban kpd Tuhan.. ayo.. nikmati trus selagi ada waktu.. :) salam dari langit.. ,1
3342,ABDANALK,ada nipple slip di menit 4.13,ABDANALK: ada nipple slip di menit 4.13,0
3343,Angga Praz,Bener2 PERKEMBANGAN & PERTUMBUHAN YA ,Angga Praz: Bener2 PERKEMBANGAN & PERTUMBUHAN YA ,1
3344,Budi Ariana,Gue yakin orang yg ada di tkp pst ngaceng semua,Budi Ariana: Gue yakin orang yg ada di tkp pst ngaceng semua,1
3345,Baharrudin Susyantoro,Jd pembantu d rumah saya aja,Baharrudin Susyantoro: Jd pembantu d rumah saya aja,1
3346,FaZHer Part II,Katanya bulan puasa setan d belenggu. Kok ini masih ada ya??? ,FaZHer Part II: Katanya bulan puasa setan d belenggu. Kok ini masih ada ya??? ,0
3347,Suyail Mustak,I want something just like this,Suyail Mustak: I want something just like this,0
3348,dangdut tv kabel,mampir chanel ku yuk di;,dangdut tv kabel: mampir chanel ku yuk di;,1
3349,Berita Indonesia dan Dunia,ingat nama apa? Jira-kira makin cantik di antara yang lain tapi sayang di bagi bagi tulgang jak rela  haha,Berita Indonesia dan Dunia: ingat nama apa? Jira-kira makin cantik di antara yang lain tapi sayang di bagi bagi tulgang jak rela  haha,0
3350,Hadiyan Saputra,Aku mau membaknya aja deh?,Hadiyan Saputra: Aku mau membaknya aja deh?,1
3351,Seto Mulyadi,Saya tidak berfaedah bro. nyocot ae lek gk pokus ke kaos nya,Seto Mulyadi: Saya tidak berfaedah bro. nyocot ae lek gk pokus ke kaos nya,0
3352,Helmi Suseno,sering2 bikin video yg kaya gini Om (y),Helmi Suseno: sering2 bikin video yg kaya gini Om (y),1
3353,Bambang Poerwoko,sekarang pertanyaanya kmu sering di hisaapp yaa hehehaehahe,Bambang Poerwoko: sekarang pertanyaanya kmu sering di hisaapp yaa hehehaehahe,1
3354,justraedi,itu pacar langsing lagi donk soalnya enak ngeliat nya ok lah tau dia pas gede hmm sebelum gue ikut ikutan,justraedi: itu pacar langsing lagi donk soalnya enak ngeliat nya ok lah tau dia pas gede hmm sebelum gue ikut ikutan,0
3355,Runtuy Winaya,Ih teu ibak heula...kmh nya...oh hoyong di ibakan eta mah cuma butuh pembantu,Runtuy Winaya: Ih teu ibak heula...kmh nya...oh hoyong di ibakan eta mah cuma butuh pembantu,0
3356,Ari Yuda,Pasti nya susunya di makeup in tu biar meling,Ari Yuda: Pasti nya susunya di makeup in tu biar meling,1
3357,Agus Trianto,Wooooow klu ada pembantu kek gtu mah abis ama gua? ,Agus Trianto: Wooooow klu ada pembantu kek gtu mah abis ama gua? ,1
3358,BahroZai Zain,Ini si mbak inem kan.,BahroZai Zain: Ini si mbak inem kan.,0
3359,Anjas Anjas,Wajar banyak prempuan penghuni apa yaaa,Anjas Anjas: Wajar banyak prempuan penghuni apa yaaa,1
3360,adhnan Wibowo,saya suka cyla dan lebih seksi lagi ya,adhnan Wibowo: saya suka cyla dan lebih seksi lagi ya,1
3361,diaz udhet,haati hati jangan coli ya buat cowowo hha,diaz udhet: haati hati jangan coli ya buat cowowo hha,1
3362,Puji Sumarno,Aku suka mangga yg di dlm BH ajah deh,Puji Sumarno: Aku suka mangga yg di dlm BH ajah deh,0
3363,Jiji Darusman,Kok ne cewek gak mandi......,Jiji Darusman: Kok ne cewek gak mandi......,1
3364,dimas aditya,Kapan nih diupload yg bisa ngalahin episode 8 grace?,dimas aditya: Kapan nih diupload yg bisa ngalahin episode 8 grace?,1
3365,wanwen project,hadir..  gue berlaganan uga lo di applikasi populer... RM 5 /BULAN... ,wanwen project: hadir..  gue berlaganan uga lo di applikasi populer... RM 5 /BULAN... ,1
3366,arik sugiono,Njey si lu jd creuee aja terus,arik sugiono: Njey si lu jd creuee aja terus,0
3367,Aden Azis,Makanan cacing tanah nanti juga..,Aden Azis: Makanan cacing tanah nanti juga..,0
3368,heran gue,Yah klo dosenya begini..kuliah harus bawa banyak celana lah..,heran gue: Yah klo dosenya begini..kuliah harus bawa banyak celana lah..,1
3369,Sanji Prasetyo,petugasnya menang banyaaaaak..,Sanji Prasetyo: petugasnya menang banyaaaaak..,1
3370,Bali baliku,saya juga pingin ngintip,Bali baliku: saya juga pingin ngintip,1
3371,Rusadi Artawijaya,Stiker apaan tuh d toket,Rusadi Artawijaya: Stiker apaan tuh d toket,0
3372,hasellblade,boleh lah diajak icip icip sama doi,hasellblade: boleh lah diajak icip icip sama doi,0
3373,Wika Oke,itu tante apa tidaknya 7 tgl cek Nyo Nyonya Gege buat pilih. ,Wika Oke: itu tante apa tidaknya 7 tgl cek Nyo Nyonya Gege buat pilih. ,0
3374,Mohammad Ilham,"syang,a yoshie gk trllu aktif di ig kiriman dikit+akun,a jga digembok","Mohammad Ilham: syang,a yoshie gk trllu aktif di ig kiriman dikit+akun,a jga digembok",1
3375,Arif Ramadhan,klo Kata gw itu bukan om mobi tapi cmn dandananya Kek untuk bisa bersamamph bgt untuk berhubungan intim knp ginian dianggap porno sih? heran,Arif Ramadhan: klo Kata gw itu bukan om mobi tapi cmn dandananya Kek untuk bisa bersamamph bgt untuk berhubungan intim knp ginian dianggap porno sih? heran,0
3376,hasellblade,bodynya grace kaya kate upton,hasellblade: bodynya grace kaya kate upton,0
3377,FaBry Irawan,Njirr.. Ampe tumpeh-tumpeh..,FaBry Irawan: Njirr.. Ampe tumpeh-tumpeh..,0
3378,Diamond BIGO LIVE GRATIS,Bosan Ah..gitu gitu aja..,Diamond BIGO LIVE GRATIS: Bosan Ah..gitu gitu aja..,0
3379,masud go,"jangan pake pelumas dari oli mesin, minyak rem, dsb hehehe..","masud go: jangan pake pelumas dari oli mesin, minyak rem, dsb hehehe..",0
3380,Boegis People,mbak titip salam yng ada di neraka ya..,Boegis People: mbak titip salam yng ada di neraka ya..,1
3381,kopi ireng,fokus ke susu bikin tegang croooot,kopi ireng: fokus ke susu bikin tegang croooot,1
3382,Zahra Citra,hahay inem mau nggak pake G-String.,Zahra Citra: hahay inem mau nggak pake G-String.,0
3383,heri haha,"Cewek semakin nakal,  semakin kaya.  Cowok semakin kaya,  semakin nakal","heri haha: Cewek semakin nakal,  semakin kaya.  Cowok semakin kaya,  semakin nakal",1
3384,Proto,hahaha damn you guys this is nothing. i found this site a few weeks ago with real girls that are horny as hell get a load of this: bit.ly/13xkNtq?=awnsg,Proto: hahaha damn you guys this is nothing. i found this site a few weeks ago with real girls that are horny as hell get a load of this: bit.ly/13xkNtq?=awnsg,1
3385,Warsa Abdul Kodir,"pantas aja d neraka banyak perempuan cantik, ternyata begini d rumah","Warsa Abdul Kodir: pantas aja d neraka banyak perempuan cantik, ternyata begini d rumah",0
3386,General Pratama,Uting nya manaa kk :v,General Pratama: Uting nya manaa kk :v,1
3387,Zahra Citra,tanks informasinya sangat membantu dan bermanfaat bangeet   jdi pengen banget ditambah style an fila lg apa gak kak? Mau bukti? Bisa langsung disini loh https://www.popular-world.com/apps,Zahra Citra: tanks informasinya sangat membantu dan bermanfaat bangeet   jdi pengen banget ditambah style an fila lg apa gak kak? Mau bukti? Bisa langsung disini loh https://www.popular-world.com/apps,0
3388,channel macam apaan & susu nya itu ikut begini d ruma,hannel macam apaan & susu nya itu ikut begini d rumah,channel macam apaan & susu nya itu ikut begini d rumah,0
3389,pas col,Apakah model2 popular masih original??,pas col: Apakah model2 popular masih original??,0
3390,Syarif Bima,minta nmr WAnya 20jt brangkatttt,Syarif Bima: minta nmr WAnya 20jt brangkatttt,1
3391,Kusuka Indomie,Mau dong digocek intan,Kusuka Indomie: Mau dong digocek intan,1
3392,Yudha Fajar Qornain,modelnya jelek ia kelihatan smbil mL ,Yudha Fajar Qornain: modelnya jelek ia kelihatan smbil mL ,0
3393,Pinak Wang Terang,Pakar zina ni orang..mampuslu..,Pinak Wang Terang: Pakar zina ni orang..mampuslu..,1
3394,Aphriell Art,haha ga ada yg bisa? kan ada navigasinya dipojok kiri atas,Aphriell Art: haha ga ada yg bisa? kan ada navigasinya dipojok kiri atas,1
3395,surya erlangga,Editornya terlalu maksa nihhh,surya erlangga: Editornya terlalu maksa nihhh,1
3396,i love you,cute semua dong yang tangan dunia tahun pendek ada di kenyot,i love you: cute semua dong yang tangan dunia tahun pendek ada di kenyot,0
3397,DIMAS NDX AKA,mbak bikin ak gak bisa tidur,DIMAS NDX AKA: mbak bikin ak gak bisa tidur,1
3398,Andre Juan Lucky Pratama,Wih seru banget nih ada selingannya tips malam jumat di buat gantian aja modelnya kak sassha sama kak derina aja ,Andre Juan Lucky Pratama: Wih seru banget nih ada selingannya tips malam jumat di buat gantian aja modelnya kak sassha sama kak derina aja ,1
3399,luthan m akmal,#kamisukapopularmagazine wkwkwkwkwkw,luthan m akmal: #kamisukapopularmagazine wkwkwkwkwkw,1
3400,Yohanes Felix Lokal,Ngapa vroh liat2in komentar?,Yohanes Felix Lokal: Ngapa vroh liat2in komentar?,1
3401,Berlin Berludin,kalau ini mah bukan inem lumayan seksi min..ini mah emang bner2 sexi bkin ngaceng' 2 juta jga mau gua,Berlin Berludin: kalau ini mah bukan inem lumayan seksi min..ini mah emang bner2 sexi bkin ngaceng' 2 juta jga mau gua,1
3402,Android Crazhy,aduuuhhh suges hehe.... Mantap ,Android Crazhy: aduuuhhh suges hehe.... Mantap ,0
3403,Eriena,keluarin di dalam lebih enak gak usah pame apa2,Eriena: keluarin di dalam lebih enak gak usah pame apa2,1
3404,Ilhamullah Ikhsan,Bikin Tutorialnya boleh?,Ilhamullah Ikhsan: Bikin Tutorialnya boleh?,0
3405,Muhamad Syawal,"Btw...inem tinggal di mana,,, kebetulan bos aku lagi cari karyawati pembantu rumah tangga..","Muhamad Syawal: Btw...inem tinggal di mana,,, kebetulan bos aku lagi cari karyawati pembantu rumah tangga..",1
3406,Thomas Hardiansyah,Hal sextra jantau kaya siti badriah,Thomas Hardiansyah: Hal sextra jantau kaya siti badriah,0
3407,Jodie Tenrile,FTS Irzablessuet belakang moen rosi telp ayo juga ,Jodie Tenrile: FTS Irzablessuet belakang moen rosi telp ayo juga ,0
3408,Zari 76,Lagu nya keren :* + vidio clip nya NTTAAAPPP (Y),Zari 76: Lagu nya keren :* + vidio clip nya NTTAAAPPP (Y),1
3409,ryan soldado,"Hmm,cowo2 yg nonton pada punya payudara semua ya wkwk","ryan soldado: Hmm,cowo2 yg nonton pada punya payudara semua ya wkwk",1
3410,Zainur Roziqin,Presenter nya bikin horny Suma semprul & dong.. Jiwa :v ,Zainur Roziqin: Presenter nya bikin horny Suma semprul & dong.. Jiwa :v ,0
3411,muhammad dahlan,modelnya bukan sex indonesia cuma orang jawa min,muhammad dahlan: modelnya bukan sex indonesia cuma orang jawa min,0
3412,fery dan sahabat,mbak mau gini in saya,fery dan sahabat: mbak mau gini in saya,0
3413,Anditian Pranata,"mau sama pacar/selingkuhan belum pernah kena hisap, yang beginian dapetnya selalu sama cewek plus-plus","Anditian Pranata: mau sama pacar/selingkuhan belum pernah kena hisap, yang beginian dapetnya selalu sama cewek plus-plus",1
3414,Neni gua Teguh Setiawan,Gege seksiin liat inem malem ma cwe w banget ?,Neni gua Teguh Setiawan: Gege seksiin liat inem malem ma cwe w banget ?,0
3415,Rizal Huda,"Kalo yang hot outdoor, berkeringat, sama Sirias (Mangsing. Buka aihh... ","Rizal Huda: Kalo yang hot outdoor, berkeringat, sama Sirias (Mangsing. Buka aihh... ",0
3416,Saharuddi Samsung,bisa aj dong klu dilepas bh  nya yaa pasti larusi gk bagus gue ngocok liat elu,Saharuddi Samsung: bisa aj dong klu dilepas bh  nya yaa pasti larusi gk bagus gue ngocok liat elu,0
3417,masuk akal,Aduhh kaka inii jago bgt ,masuk akal: Aduhh kaka inii jago bgt ,0
3418,denisz giallorossa,Mau very sexy ya....biasa tek di marahin ngak mau terus ya? hhahahaha,denisz giallorossa: Mau very sexy ya....biasa tek di marahin ngak mau terus ya? hhahahaha,0
3419,RM Ikhsan,Episode ini harusnya durasinya lama... ,RM Ikhsan: Episode ini harusnya durasinya lama... ,0
3420,Mahesa Aji Wisesa,"Video nya kan banyak cewe seksi, nyari nya dmna?","Mahesa Aji Wisesa: Video nya kan banyak cewe seksi, nyari nya dmna?",1
