,author,comment,line,true
1158,arif kuncoro,Wah kameramennya menang banyak pasti ngaceng tuh burungnya,arif kuncoro: Wah kameramennya menang banyak pasti ngaceng tuh burungnya,1
1159,Biji Peler,Thank popular megazine karena kalian saya bisa coli dengan nikmat nya,Biji Peler: Thank popular megazine karena kalian saya bisa coli dengan nikmat nya,1
1160,Syamsul Bahri,Toket mulu yg d bahas???,Syamsul Bahri: Toket mulu yg d bahas???,1
1161,JUFRI JAMIL,Singgah channel anak .. . ?????,JUFRI JAMIL: Singgah channel anak .. . ?????,0
1162,David saputra,"*akhirnya ganti profil picture juga, eneg gw sm yg ijo*","David saputra: *akhirnya ganti profil picture juga, eneg gw sm yg ijo*",0
1163,yahya ayyasy,Inem lumayan nakal hehe ,yahya ayyasy: Inem lumayan nakal hehe ,1
1164,Bobby Andrian,ini sex aduhai buahaha. masih dibahas sama Irene dan semua program Popular Magazine selanjutnya ya ,Bobby Andrian: ini sex aduhai buahaha. masih dibahas sama Irene dan semua program Popular Magazine selanjutnya ya ,0
1165,Heru Mikhael,menang banyak om motomobi,Heru Mikhael: menang banyak om motomobi,0
1166,Wildan 30,unch sexyy pengen colzzz,Wildan 30: unch sexyy pengen colzzz,1
1167,Penikmat Youtube,Kami suka cila pake turbo ,Penikmat Youtube: Kami suka cila pake turbo ,1
1168,JUFRI JAMIL,Singgah channel aku.malah aku mandi ga pake cd ,JUFRI JAMIL: Singgah channel aku.malah aku mandi ga pake cd ,1
1169,Jimmy Roy,ga ngerti lg dahhh klo ketemu cyla.n karena ky gbak ,Jimmy Roy: ga ngerti lg dahhh klo ketemu cyla.n karena ky gbak ,0
1170,Josh Pasaribu,grace iskandar siapanya johny iskandar?,Josh Pasaribu: grace iskandar siapanya johny iskandar?,0
1171,Jajang Jankrik,Kenapa toket nya rata2 gede?,Jajang Jankrik: Kenapa toket nya rata2 gede?,1
1172,Ricky Stevano,besok videonya ketemu nyonya gege ini pasti hehehehe,Ricky Stevano: besok videonya ketemu nyonya gege ini pasti hehehehe,0
1173,amin ngayao,Bisa di praktekin gak?,amin ngayao: Bisa di praktekin gak?,0
1174,Polly Gammiy,bisa goyang apa ngk????,Polly Gammiy: bisa goyang apa ngk????,1
1175,Danu Vidio Film,Ketik di google aksi nta ngaceng ya.??,Danu Vidio Film: Ketik di google aksi nta ngaceng ya.??,0
1176,eko Bagus,"Kalau sahhsa mau ndak pakek in saya kondom biar dak tumpe"" atau blener bleber","eko Bagus: Kalau sahhsa mau ndak pakek in saya kondom biar dak tumpe"" atau blener bleber",1
1177,Ahmad Zaki,ngepettt (nyegik) biar cepet kaya mah... wkwkwk,Ahmad Zaki: ngepettt (nyegik) biar cepet kaya mah... wkwkwk,1
1178,Sadly Arifianto,Kasi nonton ortunya ni vidio....,Sadly Arifianto: Kasi nonton ortunya ni vidio....,1
1179,cantrex laiho,not naked i don't like this,cantrex laiho: not naked i don't like this,1
1180,OrangeRain City,Wis uwat malu nih puting kambing,OrangeRain City: Wis uwat malu nih puting kambing,0
1181,As'ad Wae,Punya sassha lebih gedee,As'ad Wae: Punya sassha lebih gedee,0
1182,kelvin jatwa,Tante kalo pake kondom nie pelatih nya,kelvin jatwa: Tante kalo pake kondom nie pelatih nya,0
1183,Kusuk Khildik,Britang yang bagus2 apa min ,Kusuk Khildik: Britang yang bagus2 apa min ,0
1184,Rizal Fahlevi,Crotin kedadanya enak nih,Rizal Fahlevi: Crotin kedadanya enak nih,1
1185,cara bintang,"anjay era, selera kita sama grace iskandar ya...?? untuk hati lagi.","cara bintang: anjay era, selera kita sama grace iskandar ya...?? untuk hati lagi.",0
1186,Ochi Ochu,Nanti jadi tumpeh tumpeh hahahah,Ochi Ochu: Nanti jadi tumpeh tumpeh hahahah,1
1187,jalan ninja,punya masalah nonton versi grace iskandar.. udah dapet feelly diend ono ngaceng maksimal~ gitu sama ceweknya khusus untuk seseorang di video ini,jalan ninja: punya masalah nonton versi grace iskandar.. udah dapet feelly diend ono ngaceng maksimal~ gitu sama ceweknya khusus untuk seseorang di video ini,0
1188,Ubay096 Ubay,Uhh bikin gua ngiler ajh nih cwe mantaf kk,Ubay096 Ubay: Uhh bikin gua ngiler ajh nih cwe mantaf kk,1
1189,Rokhmat Nyos,"Double court nya .. ""itu"" berat nih ..","Rokhmat Nyos: Double court nya .. ""itu"" berat nih ..",0
1190,r X,Brantakan nih rmh tangga klo punya pembantu bgini Kwaakkk ,r X: Brantakan nih rmh tangga klo punya pembantu bgini Kwaakkk ,1
1191,Rifki Kun,om mobi ga dicerai-in ???,Rifki Kun: om mobi ga dicerai-in ???,1
1192,Debby siska,Tuh yg bunting payudara seksi in,Debby siska: Tuh yg bunting payudara seksi in,0
1193,samuel budi,Kalu bercintanya ma kamu sasha carisa hehehe... ,samuel budi: Kalu bercintanya ma kamu sasha carisa hehehe... ,0
1194,Lukas Bilin,bisa gila punya pembantu ky gtu,Lukas Bilin: bisa gila punya pembantu ky gtu,0
1195,cikwy adp,Ijin...promosi chanel saya,cikwy adp: Ijin...promosi chanel saya,1
1196,vlog no limit,Selalu hadir membawa like kak like ke3 komen ke1,vlog no limit: Selalu hadir membawa like kak like ke3 komen ke1,0
1197,muhammad irvan zidny,Dapet dari mana bh nya si Rachman popular di youtube aja; (,muhammad irvan zidny: Dapet dari mana bh nya si Rachman popular di youtube aja; (,0
1198,Qee Lanna,"Save video - send to Adobe Preheza: durasi nya gk jdi balapa gituu tpi lama"" agama saling mengingatkan sensasi terus tp gak malu di rumah. hehehe","Qee Lanna: Save video - send to Adobe Preheza: durasi nya gk jdi balapa gituu tpi lama"" agama saling mengingatkan sensasi terus tp gak malu di rumah. hehehe",0
1199,Anhat Sutejo,Musik latarnya lagu nya siapa min?!,Anhat Sutejo: Musik latarnya lagu nya siapa min?!,1
1200,Wendi Firmansyah,"Warna kulit si cewek bikin gereget, bikin horny.. Hehehe","Wendi Firmansyah: Warna kulit si cewek bikin gereget, bikin horny.. Hehehe",0
1201,Don Corleone Jr,"Inem nih ah suka nya ngeluh trus, padahal inem juga sering bikin pusing ""pala"" tuan majikan ","Don Corleone Jr: Inem nih ah suka nya ngeluh trus, padahal inem juga sering bikin pusing ""pala"" tuan majikan ",0
1202,inonk69,Next inem mijetin nyonya asik tuh ,inonk69: Next inem mijetin nyonya asik tuh ,1
1203,Desfa 28,Praktek donk mbak ' jngn teori mlulu ??????? Hihihi,Desfa 28: Praktek donk mbak ' jngn teori mlulu ??????? Hihihi,1
1204,andi septian,mungkin istri kyak mbak ,andi septian: mungkin istri kyak mbak ,0
1205,Friska Irfandy,Cara report channel gimna,Friska Irfandy: Cara report channel gimna,0
1206,Dwi Setiawan,Katy dah tobat sekarang coeg ! Gw mesti sedih apa seneng coba ?,Dwi Setiawan: Katy dah tobat sekarang coeg ! Gw mesti sedih apa seneng coba ?,1
1207,Luthy Hakim,Arief Maulana its a educate. not porn. go away ,Luthy Hakim: Arief Maulana its a educate. not porn. go away ,0
1208,basupati Praseja,"Pembawa acaranya,,,non muslim ya.","basupati Praseja: Pembawa acaranya,,,non muslim ya.",1
1209,April Yah,Selalu bikin merinding bulu kudu (ngaceeee**) ,April Yah: Selalu bikin merinding bulu kudu (ngaceeee**) ,1
1210,Cuplis Tai,Buat game kalah buka baju dong,Cuplis Tai: Buat game kalah buka baju dong,1
1211,ng tony,cerita nya lewat mana ?,ng tony: cerita nya lewat mana ?,0
1212,Mr Gilang,Sassa carissa tambah gemuk aku suka,Mr Gilang: Sassa carissa tambah gemuk aku suka,1
1213,Farhan Yumni,kondom nya belahan bootombod aja lengkap,Farhan Yumni: kondom nya belahan bootombod aja lengkap,0
1214,Saiful Anuar,Memeknya bauh banget nih ada hone grace,Saiful Anuar: Memeknya bauh banget nih ada hone grace,0
1215,Hamrin Hamrin,mbah kalau teori nggak seru. praktekin aja..,Hamrin Hamrin: mbah kalau teori nggak seru. praktekin aja..,1
1216,Zay Blu,Tips menstruasi buat cowok,Zay Blu: Tips menstruasi buat cowok,1
1217,Suhar Joni,Inem kayaknya ini aja... kopi kalo inemnya lg kya gni sih salami tapi kalau seksi sekali gua udah gue croot x kelemular di boking nya,Suhar Joni: Inem kayaknya ini aja... kopi kalo inemnya lg kya gni sih salami tapi kalau seksi sekali gua udah gue croot x kelemular di boking nya,0
1218,Jancok Jaran,kok ada panunya yak:v,Jancok Jaran: kok ada panunya yak:v,0
1219,Aldy Hernandez,grace the sweet smile ,Aldy Hernandez: grace the sweet smile ,1
1220,David Prawira,Punya bini kaya gini gua nggk berani trus aja.seperti mau hangout gitu,David Prawira: Punya bini kaya gini gua nggk berani trus aja.seperti mau hangout gitu,0
1221,Fahmi Pros Gaming,Ayok cantik kita ke hotel ayukk,Fahmi Pros Gaming: Ayok cantik kita ke hotel ayukk,0
1222,Max Valentieno,like your long hair ms Irene,Max Valentieno: like your long hair ms Irene,1
1223,Chaca Fabiad Jalsa,pasti udah pernah ngeseks y,Chaca Fabiad Jalsa: pasti udah pernah ngeseks y,0
1224,FaiZuL CHeLSea,sekali kali bugil dong kak bikin vidionya apa???,FaiZuL CHeLSea: sekali kali bugil dong kak bikin vidionya apa???,0
1225,Samsung Samsung,Bikin anak enak nih dipraktekin,Samsung Samsung: Bikin anak enak nih dipraktekin,0
1226,hari gatzs,dunia bentuk body tuh,hari gatzs: dunia bentuk body tuh,0
1227,Haqi Ahmad Z.E.D 29,Yahuuuud SUSU  lagiiii..  v malam jumat nya ga seru mungkin  0: Tobrohmhhh....,Haqi Ahmad Z.E.D 29: Yahuuuud SUSU  lagiiii..  v malam jumat nya ga seru mungkin  0: Tobrohmhhh....,0
1228,Firmansyah Firmansyah,ah yuk praktek in sahssa. ,Firmansyah Firmansyah: ah yuk praktek in sahssa. ,1
1229,Rimhot Nainggolan,Good drama young girl ,Rimhot Nainggolan: Good drama young girl ,1
1230,chiku pay,"Ane butuh pembantu nem, 20juta/ bulan ","chiku pay: Ane butuh pembantu nem, 20juta/ bulan ",1
1231,Rahayu Ning Tyas,https://www.youtube.com/watch?v=V5nbcDVI4Hk&t=0s,Rahayu Ning Tyas: https://www.youtube.com/watch?v=V5nbcDVI4Hk&t=0s,1
1232,D Putra,"banyakin video andrea aylin dung,, udah saya subs ni channel","D Putra: banyakin video andrea aylin dung,, udah saya subs ni channel",1
1233,Yohan Ariyanto,Uuhh ohh yessss ngeheeeee yuuk,Yohan Ariyanto: Uuhh ohh yessss ngeheeeee yuuk,1
1234,rifat doni,ini channel apa sh...,rifat doni: ini channel apa sh...,1
1235,memet pesona,"Bukanya judul harusnya ""inem LUMAYAN seksi"" ya?","memet pesona: Bukanya judul harusnya ""inem LUMAYAN seksi"" ya?",1
1236,Neo Cahyo,Mana toketnya mana toketnya,Neo Cahyo: Mana toketnya mana toketnya,1
1237,Rha Mamedth,"""The Kimcil"" diana putri (y)","Rha Mamedth: ""The Kimcil"" diana putri (y)",0
1238,rheno febriansyah,Kenapa ga sekalian aja 5detik???,rheno febriansyah: Kenapa ga sekalian aja 5detik???,0
1239,Raditya saputra,268.385 orang horny masal..,Raditya saputra: 268.385 orang horny masal..,1
1240,mchamdi isni,ada yg tau Q B N N N N N N N N Y: Itu siapa tuh semok banget,mchamdi isni: ada yg tau Q B N N N N N N N N Y: Itu siapa tuh semok banget,0
1241,Bs tv channel,jangan lama lama cepe. Ah,Bs tv channel: jangan lama lama cepe. Ah,1
1242,FILM MAKER,Tolong beri saya judul videonya,FILM MAKER: Tolong beri saya judul videonya,0
1243,Aleim Irchami,Kalo ga pake bh Uda kaya pepaya . . So hot,Aleim Irchami: Kalo ga pake bh Uda kaya pepaya . . So hot,1
1244,Hx- luke007,ngetot sehari berkali,Hx- luke007: ngetot sehari berkali,1
1245,Kenzi kagawa,Kalau sya yg jadi aktornya bakalan gaceng hahaha,Kenzi kagawa: Kalau sya yg jadi aktornya bakalan gaceng hahaha,0
1246,Darma20_,bisa bikin tegang juga ,Darma20_: bisa bikin tegang juga ,1
1247,Irwan Syah,Siapa yg tahan nengok INEM kyak Gitu Y.... ,Irwan Syah: Siapa yg tahan nengok INEM kyak Gitu Y.... ,1
1248,Wiwit Kede,iku gak susu ok...tabung gas 3 kilo,Wiwit Kede: iku gak susu ok...tabung gas 3 kilo,1
1249,ema sulastri,"Kurang hot, tapi cuma 1 yg dikasih tau.. gw terangi... ","ema sulastri: Kurang hot, tapi cuma 1 yg dikasih tau.. gw terangi... ",0
1250,Name Cannot Be Blank,dear cewek sabunnya biar lebih fresh gitu Kak ,Name Cannot Be Blank: dear cewek sabunnya biar lebih fresh gitu Kak ,0
1251,Claudia Paseu,INEEEEEMMMMMM bagus bangt,Claudia Paseu: INEEEEEMMMMMM bagus bangt,1
1252,Belprima Nainggolan,asli apa palsu tu ya... nenen ny,Belprima Nainggolan: asli apa palsu tu ya... nenen ny,0
1253,Nandar Zayan,chef marinka dong min,Nandar Zayan: chef marinka dong min,0
1254,adis koeher,toket oh toket kenapa kau gede sekali macam mana aku tak gede karena sering di colek,adis koeher: toket oh toket kenapa kau gede sekali macam mana aku tak gede karena sering di colek,1
1255,Daniel Stepanus,Tinggal pake bh saja sudah pas,Daniel Stepanus: Tinggal pake bh saja sudah pas,1
1256,widi ferdiansyah,Udh tau macet knapah masih pada dijakarta bgo,widi ferdiansyah: Udh tau macet knapah masih pada dijakarta bgo,1
1257,Bang Joul,coba kalo BH nya di lepas woooou baru bohai. kalo cuman gitu doang sih kayaknya kurang seru...,Bang Joul: coba kalo BH nya di lepas woooou baru bohai. kalo cuman gitu doang sih kayaknya kurang seru...,0
1258,Mohammad Ilham,mending potongan rambut yg dulu lbih cantik,Mohammad Ilham: mending potongan rambut yg dulu lbih cantik,0
1259,tomi arman,MALU lah pda ALLAH...    renungkan dari mana kau d ciptakan n kmana kau akan kmbali...  dunia ini fana..,tomi arman: MALU lah pda ALLAH...    renungkan dari mana kau d ciptakan n kmana kau akan kmbali...  dunia ini fana..,1
1260,Nasky dan,Ki pegang payudara mu,Nasky dan: Ki pegang payudara mu,0
1261,Neyo Zeberdee,"Komen""nya bikin ngakak anjing wkwkwk","Neyo Zeberdee: Komen""nya bikin ngakak anjing wkwkwk",1
1262,Mehgh Februari,Lebih jelas bukan grace males amat dong min siapa ya... ?? ,Mehgh Februari: Lebih jelas bukan grace males amat dong min siapa ya... ?? ,0
1263,Muhamad Riski77,bagusan toket nya ama suara nya haha,Muhamad Riski77: bagusan toket nya ama suara nya haha,1
1264,Raatu Amanda,Ap yg klian lkukan kaum adam klo anda mmpunyai pmmbantu sprti inemm??,Raatu Amanda: Ap yg klian lkukan kaum adam klo anda mmpunyai pmmbantu sprti inemm??,1
1265,Insan Gemilang,SODOK AJA DUBUR NYA MBAK NIH...BIAR TAU RASA. .HAHAHAHA,Insan Gemilang: SODOK AJA DUBUR NYA MBAK NIH...BIAR TAU RASA. .HAHAHAHA,0
1266,andi septian,musik pengin dijepit hhhh,andi septian: musik pengin dijepit hhhh,0
1267,Anisa Dif,"Ini payudara mah sok, sex tania ayu pokoknya ","Anisa Dif: Ini payudara mah sok, sex tania ayu pokoknya ",0
1268,Abi Yoga,mahalan mana sama dada ayam di pasar gan..barusan ane belanja 30rb sekilo.. kalo lebih murah ane boroong gann...,Abi Yoga: mahalan mana sama dada ayam di pasar gan..barusan ane belanja 30rb sekilo.. kalo lebih murah ane boroong gann...,1
1269,FaiZuL CHeLSea,ade kolam renang pasti enk ,FaiZuL CHeLSea: ade kolam renang pasti enk ,0
1270,Ryo Af,"udah resign aja mba inem,wis jadi bojo ku ae mba...","Ryo Af: udah resign aja mba inem,wis jadi bojo ku ae mba...",1
1271,Labazz Labazz,Sayank nya cuma gmg doank kkg di. Peraktekin sekalian ,Labazz Labazz: Sayank nya cuma gmg doank kkg di. Peraktekin sekalian ,1
1272,Iwaniwan Iwan,Sip mantap tambah lagi video seperti ini,Iwaniwan Iwan: Sip mantap tambah lagi video seperti ini,1
1273,Giga Khoirul,keliatan jarang nongol atonya ganti vebby amorra biar mantap,Giga Khoirul: keliatan jarang nongol atonya ganti vebby amorra biar mantap,0
1274,Wendy Karnevin,siapa nama model yg pake BH merah ...,Wendy Karnevin: siapa nama model yg pake BH merah ...,1
1275,BUCEK PUTRA,Nah yg ke 11...klau aq main ma kamu mbak sampai mampus gak pake CD pstnya lbh bagus heran knp asikk.. :D,BUCEK PUTRA: Nah yg ke 11...klau aq main ma kamu mbak sampai mampus gak pake CD pstnya lbh bagus heran knp asikk.. :D,0
1276,Ji Raya,Sampean njowone ngendi mbak ,Ji Raya: Sampean njowone ngendi mbak ,0
1277,rahmat hidayat,Bercinta dengan kecantuk semua,rahmat hidayat: Bercinta dengan kecantuk semua,0
1278,LDR Langitan,Enak serius ngoloco sambil liat vidionya mba mba ini jadi cpt keluar bisa 4x keluar,LDR Langitan: Enak serius ngoloco sambil liat vidionya mba mba ini jadi cpt keluar bisa 4x keluar,1
1279,imade bagas,Aku boleh daftar yang banyak juga yaaaa Kak :) ,imade bagas: Aku boleh daftar yang banyak juga yaaaa Kak :) ,0
1280,Syahron Syahron,Vidio bokep indonesia,Syahron Syahron: Vidio bokep indonesia,0
1281,Ahmad Bastian,seng foto sak kampung....,Ahmad Bastian: seng foto sak kampung....,0
1282,Fikar Fikranda,Terlanjang aja malu.. HAHAH,Fikar Fikranda: Terlanjang aja malu.. HAHAH,0
1283,santi ramerame12978,Buset itu tete enyoy banget kerja nya nengg,santi ramerame12978: Buset itu tete enyoy banget kerja nya nengg,0
1284,Ilalhamdi Baihaqi,Jual Tubuh demi Subscriber haha,Ilalhamdi Baihaqi: Jual Tubuh demi Subscriber haha,1
1285,Muha Mmad,Tolong lebih hot lg dong...,Muha Mmad: Tolong lebih hot lg dong...,1
1286,Abi Wicaksono,kayanya ke habisan ide kontent ini,Abi Wicaksono: kayanya ke habisan ide kontent ini,1
1287,Hari Adi,yang lebih hot dong gue banyak tuh om mobi,Hari Adi: yang lebih hot dong gue banyak tuh om mobi,0
1288,pas col,namen bngt konten guaiiin yg dulu lbih cantik,pas col: namen bngt konten guaiiin yg dulu lbih cantik,0
1289,achmadrosyidin 01,jangan ngajarin doang dong sassha...ayok kita praktekin sama2 mandi bareng,achmadrosyidin 01: jangan ngajarin doang dong sassha...ayok kita praktekin sama2 mandi bareng,1
1290,Singgihpratama 86,Nanti kalau menang gelarnya apaya...,Singgihpratama 86: Nanti kalau menang gelarnya apaya...,1
1291,Najwatul Karimah,kurang seru klogk dipraktekin,Najwatul Karimah: kurang seru klogk dipraktekin,0
1292,irawan syams,Inem yg beginian baru geDe.. Haha. Hay...,irawan syams: Inem yg beginian baru geDe.. Haha. Hay...,1
1293,Septianto Wawan,Main crott 2 jd sama sasha enak banget pasti ,Septianto Wawan: Main crott 2 jd sama sasha enak banget pasti ,0
1294,Rusdie Grimes,Yg baju putih nama nya firza amanda scott wk,Rusdie Grimes: Yg baju putih nama nya firza amanda scott wk,1
1295,Riko Jr Gaming,Klo peregangan anu gimana?,Riko Jr Gaming: Klo peregangan anu gimana?,1
1296,ainkaldi,Nah gtu videonya sambil wawancara jd seru . Jgn video aja,ainkaldi: Nah gtu videonya sambil wawancara jd seru . Jgn video aja,1
1297,Radith Prawira,ngakak gw. reputasi om mobi terangkum dalam kolaborasi ini..otomotif dan wanita,Radith Prawira: ngakak gw. reputasi om mobi terangkum dalam kolaborasi ini..otomotif dan wanita,1
1298,Danang Handogo,om mobi kok makin nakal ya...hahah... kalau review jangan munafik. apa lgy klo uda surga lor ,Danang Handogo: om mobi kok makin nakal ya...hahah... kalau review jangan munafik. apa lgy klo uda surga lor ,0
1299,Indo From Gamer,"Akhirnya inem make bh doang sering"" yah kyk gth","Indo From Gamer: Akhirnya inem make bh doang sering"" yah kyk gth",0
1300,saluran aer,"*kalo punya bini kaya gini, kalo belom mati jangan dikubur*","saluran aer: *kalo punya bini kaya gini, kalo belom mati jangan dikubur*",1
1301,zona merah,Meskipun mereka cara pake kondom,zona merah: Meskipun mereka cara pake kondom,0
1302,Advan Saputra,apa pesan dr cuplikan video ini berarti : membenarkan sex bebas walaupun blm menikah yang penting jaga2 pakai kondom supaya tdk hamil dan inem,Advan Saputra: apa pesan dr cuplikan video ini berarti : membenarkan sex bebas walaupun blm menikah yang penting jaga2 pakai kondom supaya tdk hamil dan inem,0
1303,Antono Dwi,Sayang banget @mutiaayu gak masuk nominasi ,Antono Dwi: Sayang banget @mutiaayu gak masuk nominasi ,1
1304,fauzi dwiantara,jurinya tegang semua tuh,fauzi dwiantara: jurinya tegang semua tuh,1
1305,Reiner Bayu Kusuma Al-Jaidi,ini aja tania love you,Reiner Bayu Kusuma Al-Jaidi: ini aja tania love you,1
1306,Sidik Hermadi,Majikannya sekilas mirip baby Margaretha . Tapi buat popular saya sarankan pakaian lebih ketat lagi dan minim . Next episode saya harap ada gerakan yg memaksa birahi saya naik. Alangkah indahnya onani dengan bayangan seperti itu,Sidik Hermadi: Majikannya sekilas mirip baby Margaretha . Tapi buat popular saya sarankan pakaian lebih ketat lagi dan minim . Next episode saya harap ada gerakan yg memaksa birahi saya naik. Alangkah indahnya onani dengan bayangan seperti itu,1
1307,Iwan Fachrudin,"Yg susu ny montok siapa nama.a,yg tduran di kasur","Iwan Fachrudin: Yg susu ny montok siapa nama.a,yg tduran di kasur",0
1308,Test Ting,Ngaceng cah cilike ih croot,Test Ting: Ngaceng cah cilike ih croot,1
1309,S. farMan,Aku suka deh dengan tips2 ka shassa,S. farMan: Aku suka deh dengan tips2 ka shassa,1
1310,Afira Adelia,"Inem ny sih oke..  Tp pakaian kurang hot, wilonna apa..?","Afira Adelia: Inem ny sih oke..  Tp pakaian kurang hot, wilonna apa..?",0
1311,Xya Vicks,"Wes ra kenceng, kendor kabeh hahahaha...","Xya Vicks: Wes ra kenceng, kendor kabeh hahahaha...",1
1312,ADI Fatwa R,Fans banget ma sasha carrisa... pengen nyubit deh wkwk,ADI Fatwa R: Fans banget ma sasha carrisa... pengen nyubit deh wkwk,1
1313,Sarah Evan,Waduh pasti mbak mbak ini memeknya na udah ledes nih ambles,Sarah Evan: Waduh pasti mbak mbak ini memeknya na udah ledes nih ambles,1
1314,Babal Abbagig,Gua fokus bokep sekalian aja nangung hhh,Babal Abbagig: Gua fokus bokep sekalian aja nangung hhh,0
1315,kartun dan anime,Udah pernah nyoba ni cewek,kartun dan anime: Udah pernah nyoba ni cewek,1
1316,Emir Adenaury,"Wah, baru tau nih. Harus segera dipraktekkan :D","Emir Adenaury: Wah, baru tau nih. Harus segera dipraktekkan :D",0
1317,Ridho Hakiki,"liburan di mana sihhh ymg, aduuuhhhhh .........","Ridho Hakiki: liburan di mana sihhh ymg, aduuuhhhhh .........",0
1318,Cahya Hardiyan Syah,"kaya betul aja namanya, masa depan uang kya bencong.. haha..","Cahya Hardiyan Syah: kaya betul aja namanya, masa depan uang kya bencong.. haha..",0
1319,Ichal Rtf,bajindul itu nya bejendol ,Ichal Rtf: bajindul itu nya bejendol ,0
1320,Adi purnama7335,"Aku mau beli 1pak, tapi saya minta di pasangin ama mbak","Adi purnama7335: Aku mau beli 1pak, tapi saya minta di pasangin ama mbak",1
1321,Anhat Sutejo,Musik latarnya lagu nya siapa min?!,Anhat Sutejo: Musik latarnya lagu nya siapa min?!,0
1322,monkey D. ace,Coba kalian tebak model mana yg udah bulunya banyak...???,monkey D. ace: Coba kalian tebak model mana yg udah bulunya banyak...???,1
1323,Sri Muhadir,"Ada temennya dong laki"" sapa tau bisa kasi tips langsung sampai 1 jam.","Sri Muhadir: Ada temennya dong laki"" sapa tau bisa kasi tips langsung sampai 1 jam.",0
1324,Efendy Ahmad,"keren bikin gue terpesona,good popular","Efendy Ahmad: keren bikin gue terpesona,good popular",0
1325,AR Gimo,Kalok video kyak gini ni.. Yg gw liat comment nya dulu.. Yg comment GG,AR Gimo: Kalok video kyak gini ni.. Yg gw liat comment nya dulu.. Yg comment GG,0
1326,Bram Soma,Jira2 shasa masih ori ndak yaaaa........,Bram Soma: Jira2 shasa masih ori ndak yaaaa........,1
1327,MATA JALAN,Ga jelas ky iklan sp**t tp di tonton jg,MATA JALAN: Ga jelas ky iklan sp**t tp di tonton jg,1
1328,John Wisewords,Mantap mbk resti tampikan detektif kelanjutanx... randy suka bnr s X GARA: Ppake pelumas dong,John Wisewords: Mantap mbk resti tampikan detektif kelanjutanx... randy suka bnr s X GARA: Ppake pelumas dong,0
1329,VipeR GAMING,Judul sound track nya apa nih?,VipeR GAMING: Judul sound track nya apa nih?,1
1330,Alan Farizi,"Makin ksini makin gk takut keliatan, itu d bwh punya anak atau gmn? Ada begitu gak saingan sama kamu  ","Alan Farizi: Makin ksini makin gk takut keliatan, itu d bwh punya anak atau gmn? Ada begitu gak saingan sama kamu  ",0
1331,m dilo,Tanggung buka semua kurang kliatan lagi :',m dilo: Tanggung buka semua kurang kliatan lagi :',0
1332,UTON,tipsnya mantep  morning glory,UTON: tipsnya mantep  morning glory,1
1333,Seno Kurniawan,orang ini pasti sukanya ngocok turuk e terus.,Seno Kurniawan: orang ini pasti sukanya ngocok turuk e terus.,0
1334,Ilham Maula,Mbak kalo mau bikin tutorial enggak usah pakai baju,Ilham Maula: Mbak kalo mau bikin tutorial enggak usah pakai baju,1
1335,hery hore,ISDA hebat bela diri juga ternyata gk kalah sm diana putri & grace iskandar harusnya di gabungin tuh tiga2 nya,hery hore: ISDA hebat bela diri juga ternyata gk kalah sm diana putri & grace iskandar harusnya di gabungin tuh tiga2 nya,0
1336,Dafy Seenthings,gw suka bngd klo shasa pake baju ini ..tambah greget,Dafy Seenthings: gw suka bngd klo shasa pake baju ini ..tambah greget,0
1337,Andyka Novianto,kami suka CILA ... eh maksudnya TURBO!,Andyka Novianto: kami suka CILA ... eh maksudnya TURBO!,1
1338,Deddy Sholeiman,"kalau dosen macam ne, maka tumpah dimana mana.","Deddy Sholeiman: kalau dosen macam ne, maka tumpah dimana mana.",1
1339,Dede TV,enaknya jadi orang berduit,Dede TV: enaknya jadi orang berduit,0
1340,Eric Reinaldo,kangen lavenia orng nih di tips malam jum'at. ,Eric Reinaldo: kangen lavenia orng nih di tips malam jum'at. ,0
1341,Sandrika Abdullah,"Gak ada sabun...  Pakai ludah pun jadi buat coli  ,,,  cuueehh cuueehhh amazing","Sandrika Abdullah: Gak ada sabun...  Pakai ludah pun jadi buat coli  ,,,  cuueehh cuueehhh amazing",1
1342,MEILIN_ LOVERSCREMOo,Yg komen ngeres semua,MEILIN_ LOVERSCREMOo: Yg komen ngeres semua,1
1343,Rahmat Akbar,shabilla kok ga ada ya di video yg promote satu2?,Rahmat Akbar: shabilla kok ga ada ya di video yg promote satu2?,1
1344,Den Kenthos,Bguss ni pnya y inem....,Den Kenthos: Bguss ni pnya y inem....,1
1345,array s,Gw jd inget pnya dosen yg cantik & sexy kya gini juga. Satu2 nya kelas yg gak pernah gw tinggalkan ,array s: Gw jd inget pnya dosen yg cantik & sexy kya gini juga. Satu2 nya kelas yg gak pernah gw tinggalkan ,0
1346,No PI,Yang komenta sok cewe cantik dicoba tuh buat saxxx.,No PI: Yang komenta sok cewe cantik dicoba tuh buat saxxx.,0
1347,Dedi Kusnandar,cb gue ya yg mijit tuh cewe pasti cewenya minta oh yes oh no,Dedi Kusnandar: cb gue ya yg mijit tuh cewe pasti cewenya minta oh yes oh no,1
1348,Dangdut Heboh,Surga dunia lagi maen ke Surga,Dangdut Heboh: Surga dunia lagi maen ke Surga,1
1349,Yusuf Sidik,siapa cowo yg mau ama lu aurat nyah aja di pamer pamerin,Yusuf Sidik: siapa cowo yg mau ama lu aurat nyah aja di pamer pamerin,1
1350,Sinal Duro,hanya demi materi serba terbuka,Sinal Duro: hanya demi materi serba terbuka,1
1351,harys sikumbang,@Dirgan Capoeira hahaha oke kalo gitu tp ntar kalo jadi dirgan ada di jakarta dong. hehehe eh ini dirgan juara jtc1 kan btw?,harys sikumbang: @Dirgan Capoeira hahaha oke kalo gitu tp ntar kalo jadi dirgan ada di jakarta dong. hehehe eh ini dirgan juara jtc1 kan btw?,1
1352,dewi mimpi,Neraka itu panas sumpah.. allah gk bohong,dewi mimpi: Neraka itu panas sumpah.. allah gk bohong,0
1353,Bang Diaz,"inem""di mna rumah' lu nem tar sy lamar lu nem udah gk tahan shasha telanjang hehehee","Bang Diaz: inem""di mna rumah' lu nem tar sy lamar lu nem udah gk tahan shasha telanjang hehehee",0
1354,Hillel Dzaky,Desahannya Mantap Gituin aku dong,Hillel Dzaky: Desahannya Mantap Gituin aku dong,0
